Date,Recipient,BusinessType,NAICS,Industry-2,Industry-3,Industry,RaceEthnicity,Gender,Veteran,NonProfit,Address,City,ZCTA,FIPS,County,CBSA,MSA,CDRegion,Jobs,Amount,Loans
2020-04-28,"Tabernacle Baptist Church Macon, Georgia, Inc.",Non-Profit,813110,Other Services (except Public Administration),"Religious, Grantmaking, Civic, Professional, and Similar Organizations",Religious Organizations ,U,U,U,Y,6611 Zebulon Rd.,Macon,31201.0,13021,Bibb County,31420,"Macon-Bibb County, GA",Central,6,25700,1
2020-04-27,Yagna Foodmart Llc,LLC,447110,Retail Trade,Gasoline Stations,Gasoline Stations with Convenience Stores ,U,U,U,N,5631 Houston Rd,Macon,31201.0,13021,Bibb County,31420,"Macon-Bibb County, GA",Central,4,25654,1
2020-05-06,Shree Swastik Llc,Chapter,447110,Retail Trade,Gasoline Stations,Gasoline Stations with Convenience Stores ,U,U,U,N,8371 Eisenhower Pkwy,Lizella,31052.0,13021,Bibb County,31420,"Macon-Bibb County, GA",Central,4,25600,1
2020-04-15,Platinum Hospitality Group Llc,LLC,721110,Accommodation and Food Services,Accommodation,Hotels (except Casino Hotels) and Motels ,Asian,Male Owned,Non-Veteran,N,951 Ga Hwy 42 N,Forsyth,31029.0,13207,Monroe County,31420,"Macon-Bibb County, GA",Central,8,25600,1
2020-04-09,"Applied Handling Systems, Inc",Corp,541614,"Professional, Scientific, and Technical Services","Professional, Scientific, and Technical Services","Process, Physical Distribution, and Logistics Consulting Services ",U,U,U,N,Po Box 569,Bolingbroke,31210.0,13207,Monroe County,31420,"Macon-Bibb County, GA",Central,3,25600,1
2020-04-28,Paul A Cable,Sole Oroprietor,524210,Finance and Insurance,Insurance Carriers and Related Activities,Insurance Agencies and Brokerages ,U,U,U,N,3375 Vista Cir,Macon,31201.0,13021,Bibb County,31420,"Macon-Bibb County, GA",Central,2,25572,1
2020-05-02,Jason Garcia Concrete Llc,LLC,238110,Construction,Specialty Trade Contractors,Poured Concrete Foundation and Structure Contractors ,U,U,U,N,241 Richard Dr,Jeffersonville,31044.0,13289,Twiggs County,31420,"Macon-Bibb County, GA",Central,6,25509,1
2020-04-13,Turf Magic,Chapter,561730,Administrative and Support and Waste Management and Remediation Services,Administrative and Support Services,Landscaping Services,U,U,U,N,509 River Overlook,Forsyth,31029.0,13207,Monroe County,31420,"Macon-Bibb County, GA",Central,5,25500,1
2020-04-27,"Hunt Law Firm, Llc",Chapter,541110,"Professional, Scientific, and Technical Services","Professional, Scientific, and Technical Services",Offices of Lawyers,U,Male Owned,Non-Veteran,N,130 North Crest Boulevard,Macon,31201.0,13021,Bibb County,31420,"Macon-Bibb County, GA",Central,2,25500,1
2020-04-30,Vastakis Holdings Llc,LLC,722511,Accommodation and Food Services,Food Services and Drinking Places,Full-Service Restaurants ,U,U,U,N,5854 Columbus Road Unit 1,Macon,31201.0,13021,Bibb County,31420,"Macon-Bibb County, GA",Central,0,25495,1
2020-04-28,"Homefirst Housing Resource Services, Inc.",Non-Profit,925110,Public Administration,"Administration of Housing Programs, Urban Planning, and Community Development",Administration of Housing Programs ,U,U,U,Y,"653 Second Street, Suite 203",Macon,31201.0,13021,Bibb County,31420,"Macon-Bibb County, GA",Central,2,25464,1
2020-05-01,S&V Education Systems,Corp,611710,Educational Services,Educational Services,Educational Support Services,U,U,U,N,817 Walnut Street,Macon,31201.0,13021,Bibb County,31420,"Macon-Bibb County, GA",Central,0,25455,1
2020-04-29,"Capitol Street Financial Services Group, Llc",Partnership,524210,Finance and Insurance,Insurance Carriers and Related Activities,Insurance Agencies and Brokerages ,U,U,U,N,850 Walnut Street,Macon,31201.0,13021,Bibb County,31420,"Macon-Bibb County, GA",Central,3,25416,1
2020-04-30,Middle Georgia Center For Academic Excellence,Non-Profit,611699,Educational Services,Educational Services,All Other Miscellaneous Schools and Instruction ,U,U,U,Y,623 Arlington Pl,Macon,31201.0,13021,Bibb County,31420,"Macon-Bibb County, GA",Central,0,25400,1
2020-07-23,"Mini-Food Stores, Inc",Corp,447110,Retail Trade,Gasoline Stations,Gasoline Stations with Convenience Stores ,White,Male Owned,Non-Veteran,N,508 Hillcrest Industrial Blvd,Macon,31201.0,13021,Bibb County,31420,"Macon-Bibb County, GA",Central,4,25400,1
2020-04-30,"Mid-Ga Carts, Llc",LLC,441228,Retail Trade,Motor Vehicle and Parts Dealers,"Motorcycle, ATV, and All Other Motor Vehicle Dealers ",U,U,U,N,897 Indian Lake Trl,Macon,31201.0,13021,Bibb County,31420,"Macon-Bibb County, GA",Central,5,25347,1
2020-04-07,"Peach Services, Inc.",Corp,238220,Construction,Specialty Trade Contractors,"Plumbing, Heating, and Air-Conditioning Contractors ",U,U,U,N,Po Box 2188,Macon,31201.0,13021,Bibb County,31420,"Macon-Bibb County, GA",Central,7,25300,1
2020-04-30,"Northside Tire, Inc.",Corp,441320,Retail Trade,Motor Vehicle and Parts Dealers,Tire Dealers ,U,U,U,N,3787 Northside Drive,Macon,31201.0,13021,Bibb County,31420,"Macon-Bibb County, GA",Central,0,25262,1
2020-08-05,Happy Haven Day Care 2,Partnership,624410,Health Care and Social Assistance,Social Assistance,Child Day Care Services ,U,U,U,N,30 Zellner Street,Forsyth,31029.0,13207,Monroe County,31420,"Macon-Bibb County, GA",Central,7,25253,1
2020-04-15,Curmar Llc,LLC,423850,Wholesale Trade,"Merchant Wholesalers, Durable Goods",Service Establishment Equipment and Supplies Merchant Wholesalers ,U,U,U,N,3245 Gray Hwy,Gray,31032.0,13169,Jones County,31420,"Macon-Bibb County, GA",Central,5,25212,1
2020-04-30,Reece Funeral Home Inc,Chapter,812210,Other Services (except Public Administration),Personal and Laundry Services,Funeral Homes and Funeral Services ,U,U,U,N,Us Hwy 80,Jeffersonville,31044.0,13289,Twiggs County,31420,"Macon-Bibb County, GA",Central,2,25200,1
2020-04-08,Akhandanand Corporation,Chapter,447110,Retail Trade,Gasoline Stations,Gasoline Stations with Convenience Stores ,Asian,Male Owned,Non-Veteran,N,961 Ga Highway 42,Forsyth,31029.0,13207,Monroe County,31420,"Macon-Bibb County, GA",Central,3,25200,1
2020-04-11,"Sneha, Inc",Chapter,721110,Accommodation and Food Services,Accommodation,Hotels (except Casino Hotels) and Motels ,U,U,U,N,4999 Eisenhower Pkwy,Macon,31201.0,13021,Bibb County,31420,"Macon-Bibb County, GA",Central,7,25100,1
2020-04-27,All Star Enterprises 10 Llc,LLC,441310,Retail Trade,Motor Vehicle and Parts Dealers,Automotive Parts and Accessories Stores ,U,Female Owned,U,N,4770 Pio Nono Ave,Macon,31201.0,13021,Bibb County,31420,"Macon-Bibb County, GA",Central,4,25087,1
2020-05-05,Middle Georgia Internal Medicine & Kidney Disease Llc,LLC,621111,Health Care and Social Assistance,Ambulatory Health Care Services,Offices of Physicians (except Mental Health Specialists) ,White,Male Owned,Non-Veteran,N,1122 Gray Hwy,Macon,31201.0,13021,Bibb County,31420,"Macon-Bibb County, GA",Central,5,25000,1
2020-04-11,Prabhu 1,Corp,445120,Retail Trade,Food and Beverage Stores,Convenience Stores ,U,U,U,N,2490 Pio Nono,Macon,31201.0,13021,Bibb County,31420,"Macon-Bibb County, GA",Central,7,25000,1
2020-04-29,"Valerie Garrett Interior Design, Llc",LLC,541410,"Professional, Scientific, and Technical Services","Professional, Scientific, and Technical Services",Interior Design Services,U,U,U,N,108 Huntington Pl,Macon,31201.0,13021,Bibb County,31420,"Macon-Bibb County, GA",Central,3,25000,1
2020-04-05,"Judd Publishing Co, Inc",Corp,511130,Information,Publishing Industries (except Internet),Book Publishers ,U,Male Owned,Non-Veteran,N,Columbus West Dr,Macon,31201.0,13021,Bibb County,31420,"Macon-Bibb County, GA",Central,50,25000,1
2020-08-08,Gateway Realty Professionals,Corp,531210,Real Estate and Rental and Leasing,Real Estate,Offices of Real Estate Agents and Brokers,U,U,U,N,555 Poplar Street,Macon,31201.0,13021,Bibb County,31420,"Macon-Bibb County, GA",Central,5,25000,1
2020-08-08,E&J Property Project Mgt Llc,Sole Oroprietor,811411,Other Services (except Public Administration),Repair and Maintenance,Home and Garden Equipment Repair and Maintenance ,U,U,U,N,707 Latrobe Way,Macon,31201.0,13021,Bibb County,31420,"Macon-Bibb County, GA",Central,5,25000,1
2020-04-08,Moonhanger Gath Llc,LLC,722511,Accommodation and Food Services,Food Services and Drinking Places,Full-Service Restaurants ,White,Male Owned,U,N,382  2Nd St,Macon,31201.0,13021,Bibb County,31420,"Macon-Bibb County, GA",Central,8,25000,1
2020-05-01,Chiarmonte Inc,Corp,453998,Retail Trade,Miscellaneous Store Retailers,All Other Miscellaneous Store Retailers (except Tobacco Stores) ,U,U,U,N,449 Summit Dr,Gray,31032.0,13169,Jones County,31420,"Macon-Bibb County, GA",Central,3,25000,1
2020-04-08,"Nancy J. O'Brien, Dmd",Sole Oroprietor,621210,Health Care and Social Assistance,Ambulatory Health Care Services,Offices of Dentists ,White,Female Owned,Non-Veteran,N,133 Lamar Street,Macon,31201.0,13021,Bibb County,31420,"Macon-Bibb County, GA",Central,4,25000,1
2020-04-28,"United In Pink, Inc",Prof. Assoc.,813212,Other Services (except Public Administration),"Religious, Grantmaking, Civic, Professional, and Similar Organizations",Voluntary Health Organizations ,Hispanic,Female Owned,Non-Veteran,N,1515 Bass Road,Macon,31201.0,13021,Bibb County,31420,"Macon-Bibb County, GA",Central,4,25000,1
2020-05-01,Middle Ga Auto Auction Llc,LLC,441120,Retail Trade,Motor Vehicle and Parts Dealers,Used Car Dealers ,U,U,U,N,1090 Riverside Dr,Macon,31201.0,13021,Bibb County,31420,"Macon-Bibb County, GA",Central,3,24997,1
2020-04-28,Southern Association Services Inc,Corp,813910,Other Services (except Public Administration),"Religious, Grantmaking, Civic, Professional, and Similar Organizations",Business Associations ,U,U,U,N,2286 Ingleside Ave,Macon,31201.0,13021,Bibb County,31420,"Macon-Bibb County, GA",Central,3,24973,1
2020-05-02,"John J. Orlando, Pe, Llc",Sole Oroprietor,541330,"Professional, Scientific, and Technical Services","Professional, Scientific, and Technical Services",Engineering Services,U,U,U,N,165 Old Ridge Rd,Macon,31201.0,13021,Bibb County,31420,"Macon-Bibb County, GA",Central,2,24957,1
2020-04-29,Al Sihah Shriners,Non-Profit,813990,Other Services (except Public Administration),"Religious, Grantmaking, Civic, Professional, and Similar Organizations","Other Similar Organizations (except Business, Professional, Labor, and Political Organizations) ",U,U,U,Y,222 Mecca Drive,Macon,31201.0,13021,Bibb County,31420,"Macon-Bibb County, GA",Central,8,24826,1
2020-06-08,"Harrison'S Landscape, Llc",LLC,561730,Administrative and Support and Waste Management and Remediation Services,Administrative and Support Services,Landscaping Services,U,U,U,N,5975 Columbus Rd,Macon,31201.0,13021,Bibb County,31420,"Macon-Bibb County, GA",Central,7,24800,1
2020-04-14,Holy Spirit Catholic Church,Non-Profit,813110,Other Services (except Public Administration),"Religious, Grantmaking, Civic, Professional, and Similar Organizations",Religious Organizations ,U,U,U,Y,4074 Chambers Rd,Macon,31201.0,13021,Bibb County,31420,"Macon-Bibb County, GA",Central,7,24746,1
2020-04-11,"Reflections Psychotherapy, Llc",LLC,624190,Health Care and Social Assistance,Social Assistance,Other Individual and Family Services ,U,Female Owned,Non-Veteran,N,183 W Clinton St,Gray,31032.0,13169,Jones County,31420,"Macon-Bibb County, GA",Central,2,24680,1
2020-04-30,Southern Elite Restaurant Group Llc,LLC,722511,Accommodation and Food Services,Food Services and Drinking Places,Full-Service Restaurants ,U,U,U,N,408 Martin Luther King Jr Blvd,Macon,31201.0,13021,Bibb County,31420,"Macon-Bibb County, GA",Central,0,24578,1
2020-05-01,"Howard Perofsky, Md",Sole Oroprietor,621111,Health Care and Social Assistance,Ambulatory Health Care Services,Offices of Physicians (except Mental Health Specialists) ,U,U,U,N,682 Hemlock St Ste 230,Macon,31201.0,13021,Bibb County,31420,"Macon-Bibb County, GA",Central,3,24565,1
2020-04-29,Anju Investments Inc.,Corp,721110,Accommodation and Food Services,Accommodation,Hotels (except Casino Hotels) and Motels ,U,U,U,N,1044 Riverside Dr,Macon,31201.0,13021,Bibb County,31420,"Macon-Bibb County, GA",Central,9,24524,1
2020-04-28,Dathansa Llc Dba Sakura Japanese Restaurant,LLC,722511,Accommodation and Food Services,Food Services and Drinking Places,Full-Service Restaurants ,U,U,U,N,846 Shurling Dr,Macon,31201.0,13021,Bibb County,31420,"Macon-Bibb County, GA",Central,5,24510,1
2020-04-27,Eventual Success Llc,LLC,541618,"Professional, Scientific, and Technical Services","Professional, Scientific, and Technical Services",Other Management Consulting Services ,U,Female Owned,U,N,555 Poplar St,Macon,31201.0,13021,Bibb County,31420,"Macon-Bibb County, GA",Central,7,24392,1
2020-04-29,"Anna Greer Interiors,Llc",LLC,541410,"Professional, Scientific, and Technical Services","Professional, Scientific, and Technical Services",Interior Design Services,U,U,U,N,169 Country Club Rd,Macon,31201.0,13021,Bibb County,31420,"Macon-Bibb County, GA",Central,1,24375,1
2020-04-29,"Larry E Landers D D S, P C",LLP,621210,Health Care and Social Assistance,Ambulatory Health Care Services,Offices of Dentists ,U,Male Owned,Non-Veteran,N,155 College Street,Macon,31201.0,13021,Bibb County,31420,"Macon-Bibb County, GA",Central,3,24367,1
2020-04-29,"Hamlin & Associates, Llc",LLC,541611,"Professional, Scientific, and Technical Services","Professional, Scientific, and Technical Services",Administrative Management and General Management Consulting Services ,U,U,U,N,321 B Corporate Pkwy,Macon,31201.0,13021,Bibb County,31420,"Macon-Bibb County, GA",Central,3,24365,1
2020-04-28,Ri-Bo Inc,Corp,492110,Transportation and Warehousing,Couriers and Messengers,Couriers and Express Delivery Services,U,U,U,N,3772 Trophy Pl,Lizella,31052.0,13021,Bibb County,31420,"Macon-Bibb County, GA",Central,6,24365,1
2020-06-08,Abundant Care Service Llc,LLC,621610,Health Care and Social Assistance,Ambulatory Health Care Services,Home Health Care Services,U,U,U,N,125 Plantation Centre Dr,Macon,31201.0,13021,Bibb County,31420,"Macon-Bibb County, GA",Central,9,24360,1
2020-04-27,"Central City Construction, Llc",LLC,236116,Construction,Construction of Buildings,New Multifamily Housing Construction (except For-Sale Builders) ,White,Female Owned,U,N,"543 Second Street, Suite 103",Macon,31201.0,13021,Bibb County,31420,"Macon-Bibb County, GA",Central,2,24340,1
2020-04-29,Unionville Missionary Baptist Church,Non-Profit,813110,Other Services (except Public Administration),"Religious, Grantmaking, Civic, Professional, and Similar Organizations",Religious Organizations ,U,U,U,Y,3837 Houston Ave,Macon,31201.0,13021,Bibb County,31420,"Macon-Bibb County, GA",Central,23,24307,1
2020-04-28,Holmes Insurance Services,Sole Oroprietor,524210,Finance and Insurance,Insurance Carriers and Related Activities,Insurance Agencies and Brokerages ,U,U,U,N,801 Saint Andrews Dr,Macon,31201.0,13021,Bibb County,31420,"Macon-Bibb County, GA",Central,1,24305,1
2020-04-27,"Vanhuss Poultry, Inc.",Corp,112320,"Agriculture, Forestry, Fishing and Hunting",Animal Production and Aquaculture,Broilers and Other Meat Type Chicken Production ,U,U,U,N,543 Rumble Road,Forsyth,31029.0,13207,Monroe County,31420,"Macon-Bibb County, GA",Central,3,24300,1
2020-04-07,"Bluekrishna Hotel Investment, Llc",LLC,721110,Accommodation and Food Services,Accommodation,Hotels (except Casino Hotels) and Motels ,Asian,Male Owned,Non-Veteran,N,4765 Chambers Rd,Macon,31201.0,13021,Bibb County,31420,"Macon-Bibb County, GA",Central,0,24300,1
2020-05-01,"Columbus Research Group, Llc",LLC,541712,,,,U,U,U,N,890 2Nd St,Macon,31201.0,13021,Bibb County,31420,"Macon-Bibb County, GA",Central,4,24250,1
2020-04-13,"Sk Associates, Inc.",Corp,447110,Retail Trade,Gasoline Stations,Gasoline Stations with Convenience Stores ,U,U,U,N,295 West Clinton Street,Gray,31032.0,13169,Jones County,31420,"Macon-Bibb County, GA",Central,4,24200,1
2020-04-28,"Kathy P. Welch, Dmd, General Dentist, Pc",Chapter,621210,Health Care and Social Assistance,Ambulatory Health Care Services,Offices of Dentists ,U,U,U,N,127 Lamar Street,Macon,31201.0,13021,Bibb County,31420,"Macon-Bibb County, GA",Central,4,24139,1
2020-05-01,"Plmmg, Llc.",Corp,812310,Other Services (except Public Administration),Personal and Laundry Services,Coin-Operated Laundries and Drycleaners ,U,U,U,N,2081 Pio Nono Avenue,Macon,31201.0,13021,Bibb County,31420,"Macon-Bibb County, GA",Central,0,24100,1
2020-04-04,"Don Johnson Bonding Co., Inc",LLC,812990,Other Services (except Public Administration),Personal and Laundry Services,All Other Personal Services ,White,Male Owned,U,N,509 County Line Rd,Haddock,31033.0,13169,Jones County,31420,"Macon-Bibb County, GA",Central,2,24000,1
2020-04-30,Bob Lewis & Assocites Inc.,Corp,531210,Real Estate and Rental and Leasing,Real Estate,Offices of Real Estate Agents and Brokers,U,U,U,N,201 Second Street Suite 1202,Macon,31201.0,13021,Bibb County,31420,"Macon-Bibb County, GA",Central,0,24000,1
2020-04-30,Bickley Design Build Service,Chapter,236118,Construction,Construction of Buildings,Residential Remodelers ,U,Male Owned,Non-Veteran,N,2918 Vineville Ave,Macon,31201.0,13021,Bibb County,31420,"Macon-Bibb County, GA",Central,3,24000,1
2020-05-12,"Commonwealth Logistics Service, Llc",LLC,488510,Transportation and Warehousing,Support Activities for Transportation,Freight Transportation Arrangement ,U,Male Owned,Non-Veteran,N,4570 Pio Nono Ave,Macon,31201.0,13021,Bibb County,31420,"Macon-Bibb County, GA",Central,1,23958,1
2020-04-14,"Frank Taylor Enterprises, Inc.",Corp,238290,Construction,Specialty Trade Contractors,Other Building Equipment Contractors ,U,U,U,N,807 Plantation Club Dr,Gray,31032.0,13169,Jones County,31420,"Macon-Bibb County, GA",Central,5,23800,1
2020-05-01,Benney Llc,LLC,999990,,,,U,U,U,N,3336 Mercer University Dr,Macon,31201.0,13021,Bibb County,31420,"Macon-Bibb County, GA",Central,8,23750,1
2020-04-28,"Stephan E Cheek, Inc",Corp,524210,Finance and Insurance,Insurance Carriers and Related Activities,Insurance Agencies and Brokerages ,U,U,U,N,1027 Walnut Street,Macon,31201.0,13021,Bibb County,31420,"Macon-Bibb County, GA",Central,3,23660,1
2020-04-28,"Jre Services, Llc",LLC,112990,"Agriculture, Forestry, Fishing and Hunting",Animal Production and Aquaculture,All Other Animal Production ,American Indian or Alaska Native,Male Owned,Non-Veteran,N,934 Lamar Road,Macon,31201.0,13021,Bibb County,31420,"Macon-Bibb County, GA",Central,3,23607,1
2020-04-10,3000 Customz Llc,Corp,336390,Manufacturing,Transportation Equipment Manufacturing,Other Motor Vehicle Parts Manufacturing,U,Male Owned,Non-Veteran,N,1750 Keystone St.,Macon,31201.0,13021,Bibb County,31420,"Macon-Bibb County, GA",Central,2,23600,1
2020-05-07,"Wells Engineering, Llc",LLC,541330,"Professional, Scientific, and Technical Services","Professional, Scientific, and Technical Services",Engineering Services,U,U,U,N,112 Northridge Dr,Macon,31201.0,13021,Bibb County,31420,"Macon-Bibb County, GA",Central,2,23568,1
2020-07-10,Seekie Law Firm,LLC,541110,"Professional, Scientific, and Technical Services","Professional, Scientific, and Technical Services",Offices of Lawyers,U,U,U,N,241 3Rd Street # 200,Macon,31201.0,13021,Bibb County,31420,"Macon-Bibb County, GA",Central,2,23550,1
2020-04-27,Twilight Consulting & Management Llc,LLC,561110,Administrative and Support and Waste Management and Remediation Services,Administrative and Support Services,Office Administrative Services,U,Male Owned,U,N,480 Eatonton Hwy,Gray,31032.0,13169,Jones County,31420,"Macon-Bibb County, GA",Central,2,23479,1
2020-04-28,Christian Sandefur,Sole Oroprietor,541330,"Professional, Scientific, and Technical Services","Professional, Scientific, and Technical Services",Engineering Services,U,U,U,N,6055 Lakeside Commons Dr 300,Macon,31201.0,13021,Bibb County,31420,"Macon-Bibb County, GA",Central,2,23430,1
2020-04-29,"Rural Health Works, Inc",Non-Profit,621498,Health Care and Social Assistance,Ambulatory Health Care Services,All Other Outpatient Care Centers ,U,U,U,Y,300 Mulberry St,Macon,31201.0,13021,Bibb County,31420,"Macon-Bibb County, GA",Central,2,23339,1
2020-04-15,Absolute Breakdown Llc,LLC,336310,Manufacturing,Transportation Equipment Manufacturing,Motor Vehicle Gasoline Engine and Engine Parts Manufacturing,U,U,U,N,30 Watson Rd,Forsyth,31029.0,13207,Monroe County,31420,"Macon-Bibb County, GA",Central,2,23328,1
2020-04-16,"Wallace Miller Iii, Llc",LLC,541110,"Professional, Scientific, and Technical Services","Professional, Scientific, and Technical Services",Offices of Lawyers,U,U,U,N,509 Forest Hill Rd,Macon,31201.0,13021,Bibb County,31420,"Macon-Bibb County, GA",Central,2,23200,1
2020-04-07,Country Oaks Farm & Pet Supply Inc,Chapter,453910,Retail Trade,Miscellaneous Store Retailers,Pet and Pet Supplies Stores ,White,Female Owned,Non-Veteran,N,5967 Highway 41 S,Macon,31201.0,13021,Bibb County,31420,"Macon-Bibb County, GA",Central,5,23171,1
2020-05-01,"Wtb Services, Inc.",Corp,541519,"Professional, Scientific, and Technical Services","Professional, Scientific, and Technical Services",Other Computer Related Services,White,Male Owned,Non-Veteran,N,150 Brookwood Way,Macon,31201.0,13021,Bibb County,31420,"Macon-Bibb County, GA",Central,3,23100,1
2020-04-28,"Ivey Floor Coverings, Inc.",Corp,238330,Construction,Specialty Trade Contractors,Flooring Contractors,U,U,U,N,4492 Knight Road,Macon,31201.0,13021,Bibb County,31420,"Macon-Bibb County, GA",Central,5,23017,1
2020-04-14,"Lithopress, Inc",Corp,323111,Manufacturing,Printing and Related Support Activities,Commercial Printing (except Screen and Books) ,U,U,U,N,2947 Joycliff Rd,Macon,31201.0,13021,Bibb County,31420,"Macon-Bibb County, GA",Central,4,23000,1
2020-07-29,Showtime Kennels Inc. Dba Creekside Pet Lodge,Chapter,112990,"Agriculture, Forestry, Fishing and Hunting",Animal Production and Aquaculture,All Other Animal Production ,U,U,U,N,1409 Tucker Rd,Macon,31201.0,13021,Bibb County,31420,"Macon-Bibb County, GA",Central,6,22995,1
2020-04-28,"Shree Ramdev, Llc",Chapter,453998,Retail Trade,Miscellaneous Store Retailers,All Other Miscellaneous Store Retailers (except Tobacco Stores) ,U,U,U,N,445 Tift College Drive,Forsyth,31029.0,13207,Monroe County,31420,"Macon-Bibb County, GA",Central,6,22950,1
2020-04-10,J.L. Perkins Wealth Management,Chapter,523930,Finance and Insurance,"Securities, Commodity Contracts, and Other Financial Investments and Related Activities",Investment Advice ,White,Male Owned,Non-Veteran,N,200 Northside Xing,Macon,31201.0,13021,Bibb County,31420,"Macon-Bibb County, GA",Central,3,22911,1
2020-04-15,Larry Keith Parks,Sole Oroprietor,811111,Other Services (except Public Administration),Repair and Maintenance,General Automotive Repair ,U,U,U,N,24 Town Creek Rd,Forsyth,31029.0,13207,Monroe County,31420,"Macon-Bibb County, GA",Central,2,22784,1
2020-04-28,Red Oak Remodeling Llc,Chapter,236118,Construction,Construction of Buildings,Residential Remodelers ,U,U,U,N,1122 Montpelier Rd,Forsyth,31029.0,13207,Monroe County,31420,"Macon-Bibb County, GA",Central,3,22733,1
2020-04-28,"Claxton Anesthesia Services, Llc",LLC,621111,Health Care and Social Assistance,Ambulatory Health Care Services,Offices of Physicians (except Mental Health Specialists) ,White,U,U,N,5777 Ga Hwy 42 N,Forsyth,31029.0,13207,Monroe County,31420,"Macon-Bibb County, GA",Central,1,22707,1
2020-04-29,"Morseman Equipment Company, Inc",Chapter,532412,Real Estate and Rental and Leasing,Rental and Leasing Services,"Construction, Mining, and Forestry Machinery and Equipment Rental and Leasing ",U,U,U,N,1210 5Th St,Macon,31201.0,13021,Bibb County,31420,"Macon-Bibb County, GA",Central,3,22701,1
2020-08-07,Erdley Caribbean Delight Llc,Chapter,722511,Accommodation and Food Services,Food Services and Drinking Places,Full-Service Restaurants ,U,U,U,N,"140, Rosemoore ,",Macon,31201.0,13021,Bibb County,31420,"Macon-Bibb County, GA",Central,0,22700,1
2020-04-08,A & A Pharmacy Llc,LLC,446110,Retail Trade,Health and Personal Care Stores,Pharmacies and Drug Stores ,U,U,U,N,4683 Log Cabin Dr,Macon,31201.0,13021,Bibb County,31420,"Macon-Bibb County, GA",Central,0,22700,1
2020-04-28,"The Law Offices Of James E. Patterson, P.C.",Chapter,541110,"Professional, Scientific, and Technical Services","Professional, Scientific, and Technical Services",Offices of Lawyers,U,U,U,N,20 East Main Street,Forsyth,31029.0,13207,Monroe County,31420,"Macon-Bibb County, GA",Central,3,22613,1
2020-05-26,Repairs & Maintenance Services Inc.,Corp,236210,Construction,Construction of Buildings,Industrial Building Construction ,U,U,U,N,483 Crabapple Pl,Macon,31201.0,13021,Bibb County,31420,"Macon-Bibb County, GA",Central,0,22565,1
2020-04-15,"At Ease Therapeutic Massage, Inc",Chapter,621399,Health Care and Social Assistance,Ambulatory Health Care Services,Offices of All Other Miscellaneous Health Practitioners ,U,U,U,N,347 Clayton English Dr,Forsyth,31029.0,13207,Monroe County,31420,"Macon-Bibb County, GA",Central,3,22525,1
2020-04-30,The Law Offices Of Kevin Bradley P.C,Chapter,541110,"Professional, Scientific, and Technical Services","Professional, Scientific, and Technical Services",Offices of Lawyers,U,U,U,N,"4619 Sheraton Drive, Suite 100",Macon,31201.0,13021,Bibb County,31420,"Macon-Bibb County, GA",Central,2,22523,1
2020-04-27,"Forsyth Feed & Seed, Inc.",Chapter,424910,Wholesale Trade,"Merchant Wholesalers, Nondurable Goods",Farm Supplies Merchant Wholesalers ,U,U,U,N,45 W. Johnston St,Forsyth,31029.0,13207,Monroe County,31420,"Macon-Bibb County, GA",Central,5,22514,1
2020-04-15,T E Anesthesia Llc,LLC,621112,Health Care and Social Assistance,Ambulatory Health Care Services,"Offices of Physicians, Mental Health Specialists ",U,U,U,N,220 Providence Blvd,Macon,31201.0,13021,Bibb County,31420,"Macon-Bibb County, GA",Central,1,22500,1
2020-04-11,Akc Partners Llc,LLC,523999,Finance and Insurance,"Securities, Commodity Contracts, and Other Financial Investments and Related Activities",Miscellaneous Financial Investment Activities ,U,U,Non-Veteran,N,3920 Arkwright Rd Ste 100,Macon,31201.0,13021,Bibb County,31420,"Macon-Bibb County, GA",Central,3,22500,1
