Date,Recipient,BusinessType,NAICS,Industry-2,Industry-3,Industry,RaceEthnicity,Gender,Veteran,NonProfit,Address,City,ZCTA,FIPS,County,CBSA,MSA,CDRegion,Jobs,Amount,Loans
2020-04-14,"Baptists Today, Inc.",Non-Profit,813110,Other Services (except Public Administration),"Religious, Grantmaking, Civic, Professional, and Similar Organizations",Religious Organizations ,U,U,U,Y,Po Box 6318,Macon,31201.0,13021,Bibb County,31420,"Macon-Bibb County, GA",Central,8,71122,1
2020-04-10,"Renfroe Outdoor, Llc",LLC,541850,"Professional, Scientific, and Technical Services","Professional, Scientific, and Technical Services",Outdoor Advertising,U,U,U,N,3920 Ridge Ave,Macon,31201.0,13021,Bibb County,31420,"Macon-Bibb County, GA",Central,5,71095,1
2020-04-28,Quality Computer Systems,Corp,443142,Retail Trade,Electronics and Appliance Stores,Electronics Stores ,U,Male Owned,Non-Veteran,N,2940 Riverside Dr,Macon,31201.0,13021,Bibb County,31420,"Macon-Bibb County, GA",Central,13,71000,1
2020-04-29,Lakeside Pain Center Pc,Chapter,621399,Health Care and Social Assistance,Ambulatory Health Care Services,Offices of All Other Miscellaneous Health Practitioners ,U,Male Owned,U,N,Lakeside Commons Dr,Macon,31201.0,13021,Bibb County,31420,"Macon-Bibb County, GA",Central,7,70829,1
2020-04-08,"Middle Georgia Anesthesia Services, Llc",LLC,621111,Health Care and Social Assistance,Ambulatory Health Care Services,Offices of Physicians (except Mental Health Specialists) ,U,U,U,N,207 Fishermans Cv,Lizella,31052.0,13021,Bibb County,31420,"Macon-Bibb County, GA",Central,3,70787,1
2020-04-30,"Taylor-Rutherford Bowling Supplies & Trophies, Inc.",Corp,453998,Retail Trade,Miscellaneous Store Retailers,All Other Miscellaneous Store Retailers (except Tobacco Stores) ,U,U,U,N,4313 Pio Nono Avenue,Macon,31201.0,13021,Bibb County,31420,"Macon-Bibb County, GA",Central,0,70672,1
2020-04-27,"Anthony Clark, Cpa",Sole Oroprietor,541211,"Professional, Scientific, and Technical Services","Professional, Scientific, and Technical Services",Offices of Certified Public Accountants ,White,Male Owned,Non-Veteran,N,3040 Riverside Drive,Macon,31201.0,13021,Bibb County,31420,"Macon-Bibb County, GA",Central,7,70613,1
2020-04-15,Quality Installation Service - Atlanta Market Granite Llc,LLC,238290,Construction,Specialty Trade Contractors,Other Building Equipment Contractors ,U,U,U,N,3455 Osborne Place,Macon,31201.0,13021,Bibb County,31420,"Macon-Bibb County, GA",Central,8,70600,1
2020-04-14,"Sedghi Law, Llc",LLC,541110,"Professional, Scientific, and Technical Services","Professional, Scientific, and Technical Services",Offices of Lawyers,U,Male Owned,Non-Veteran,N,2870 Vineville Ave,Macon,31201.0,13021,Bibb County,31420,"Macon-Bibb County, GA",Central,8,70500,1
2020-08-03,Par Church Builders Inc,Corp,236220,Construction,Construction of Buildings,Commercial and Institutional Building Construction ,U,U,U,N,1386 Waverland Dr,Macon,31201.0,13021,Bibb County,31420,"Macon-Bibb County, GA",Central,6,70418,1
2020-04-29,Amd Of Macon Inc,Chapter,484110,Transportation and Warehousing,Truck Transportation,"General Freight Trucking, Local ",U,U,U,N,4010 Northside Dr,Macon,31201.0,13021,Bibb County,31420,"Macon-Bibb County, GA",Central,12,70305,1
2020-04-13,"Noland Law Firm, Llc",LLC,541110,"Professional, Scientific, and Technical Services","Professional, Scientific, and Technical Services",Offices of Lawyers,U,U,U,N,"5400 Riverside Dr., Suite 205",Macon,31201.0,13021,Bibb County,31420,"Macon-Bibb County, GA",Central,4,70300,1
2020-05-01,Josephgivens,Sole Oroprietor,624410,Health Care and Social Assistance,Social Assistance,Child Day Care Services ,U,Male Owned,U,N,883 Burrus Rd,Macon,31201.0,13021,Bibb County,31420,"Macon-Bibb County, GA",Central,17,70250,1
2020-05-11,"24/7 A.S.A.P. Staffing, Inc.",Corp,561311,Administrative and Support and Waste Management and Remediation Services,Administrative and Support Services,Employment Placement Agencies ,U,U,U,N,544 Mulberry Street Suite 318,Macon,31201.0,13021,Bibb County,31420,"Macon-Bibb County, GA",Central,41,70240,1
2020-04-12,"Walker Dental Group, Llc",Corp,621210,Health Care and Social Assistance,Ambulatory Health Care Services,Offices of Dentists ,White,Male Owned,U,N,2700 Northside Xing,Macon,31201.0,13021,Bibb County,31420,"Macon-Bibb County, GA",Central,8,70097,1
2020-04-27,"Spotless Cleaning & Carpet Service, Inc.",Corp,561740,Administrative and Support and Waste Management and Remediation Services,Administrative and Support Services,Carpet and Upholstery Cleaning Services,U,U,U,N,4226 Hartley Bridge Rd Suite 104,Macon,31201.0,13021,Bibb County,31420,"Macon-Bibb County, GA",Central,12,70017,1
2020-04-10,Sphinx Inc,Chapter,323111,Manufacturing,Printing and Related Support Activities,Commercial Printing (except Screen and Books) ,U,U,U,N,7400 Airport Dr,Macon,31201.0,13021,Bibb County,31420,"Macon-Bibb County, GA",Central,7,70000,1
2020-04-29,Ingram Entities Inc,Chapter,531390,Real Estate and Rental and Leasing,Real Estate,Other Activities Related to Real Estate ,U,Male Owned,U,N,6 East Johnston St,Forsyth,31029.0,13207,Monroe County,31420,"Macon-Bibb County, GA",Central,4,70000,1
2020-04-08,Southern Majority Llc,LLC,541820,"Professional, Scientific, and Technical Services","Professional, Scientific, and Technical Services",Public Relations Agencies,U,U,U,N,544 Mulberry Street,Macon,31201.0,13021,Bibb County,31420,"Macon-Bibb County, GA",Central,8,70000,1
2020-04-14,"Simple Air Solutions, Llc",Corp,423830,Wholesale Trade,"Merchant Wholesalers, Durable Goods",Industrial Machinery and Equipment Merchant Wholesalers ,U,U,U,N,365 College St,Forsyth,31029.0,13207,Monroe County,31420,"Macon-Bibb County, GA",Central,8,69600,1
2020-04-14,"Dwc, Inc",Chapter,561740,Administrative and Support and Waste Management and Remediation Services,Administrative and Support Services,Carpet and Upholstery Cleaning Services,White,Male Owned,Non-Veteran,N,5456 Rogers Rd,Lizella,31052.0,13021,Bibb County,31420,"Macon-Bibb County, GA",Central,9,69500,1
2020-04-08,"Richard A. Eisner, M.D., P.C.",Chapter,621111,Health Care and Social Assistance,Ambulatory Health Care Services,Offices of Physicians (except Mental Health Specialists) ,U,U,U,N,125 Plantation Centre Dr,Macon,31201.0,13021,Bibb County,31420,"Macon-Bibb County, GA",Central,5,69500,1
2020-04-14,Rutland Ace Hardware,LLC,453998,Retail Trade,Miscellaneous Store Retailers,All Other Miscellaneous Store Retailers (except Tobacco Stores) ,U,Male Owned,Non-Veteran,N,3600 Riverside Dr,Macon,31201.0,13021,Bibb County,31420,"Macon-Bibb County, GA",Central,12,69165,1
2020-04-14,"Techlan, Inc.",Corp,561621,Administrative and Support and Waste Management and Remediation Services,Administrative and Support Services,Security Systems Services (except Locksmiths) ,White,Male Owned,Non-Veteran,N,895 Burrus Rd,Macon,31201.0,13021,Bibb County,31420,"Macon-Bibb County, GA",Central,7,69117,1
2020-05-14,Club 9 Llc,LLC,711190,"Arts, Entertainment, and Recreation","Performing Arts, Spectator Sports, and Related Industries",Other Performing Arts Companies ,U,Male Owned,Non-Veteran,N,2471 Pio Nono Ave,Macon,31201.0,13021,Bibb County,31420,"Macon-Bibb County, GA",Central,27,68905,1
2020-04-10,Bullard Wangerin & Corbett Llp,LLP,541110,"Professional, Scientific, and Technical Services","Professional, Scientific, and Technical Services",Offices of Lawyers,U,U,U,N,4077 Forsyth Road,Macon,31201.0,13021,Bibb County,31420,"Macon-Bibb County, GA",Central,11,68600,1
2020-04-28,"Dairy Queen Of Macon, Inc.",Chapter,722513,Accommodation and Food Services,Food Services and Drinking Places,Limited-Service Restaurants ,U,U,U,N,4760 Log Cabin Dr,Macon,31201.0,13021,Bibb County,31420,"Macon-Bibb County, GA",Central,0,68350,1
2020-04-13,"Georgia Center Services, Inc",Corp,621111,Health Care and Social Assistance,Ambulatory Health Care Services,Offices of Physicians (except Mental Health Specialists) ,U,U,U,N,6326 Peake Rd,Macon,31201.0,13021,Bibb County,31420,"Macon-Bibb County, GA",Central,9,68296,1
2020-04-16,"Sheila Kay Shah Dmd, Llc",LLC,621999,Health Care and Social Assistance,Ambulatory Health Care Services,All Other Miscellaneous Ambulatory Health Care Services ,White,Female Owned,Non-Veteran,N,4929 Forsyth Rd,Macon,31201.0,13021,Bibb County,31420,"Macon-Bibb County, GA",Central,8,68122,1
2020-04-11,"Boncorp, Inc",Chapter,812990,Other Services (except Public Administration),Personal and Laundry Services,All Other Personal Services ,White,U,Non-Veteran,N,665 Oglethorpe St,Macon,31201.0,13021,Bibb County,31420,"Macon-Bibb County, GA",Central,7,68022,1
2020-04-27,"Safeway Security Systems, Inc.",Corp,561621,Administrative and Support and Waste Management and Remediation Services,Administrative and Support Services,Security Systems Services (except Locksmiths) ,U,U,U,N,3996 Mercer University Dr,Macon,31201.0,13021,Bibb County,31420,"Macon-Bibb County, GA",Central,5,68000,1
2020-04-05,L R B Inc,Corp,722513,Accommodation and Food Services,Food Services and Drinking Places,Limited-Service Restaurants ,Asian,Male Owned,Non-Veteran,N,121 Tom Hill Sr Blvd,Macon,31201.0,13021,Bibb County,31420,"Macon-Bibb County, GA",Central,9,67720,1
2020-04-15,Overtyme Bar & Grill Inc,Corp,722511,Accommodation and Food Services,Food Services and Drinking Places,Full-Service Restaurants ,Black or African American,U,U,N,2455 Pio Nono Ave,Macon,31201.0,13021,Bibb County,31420,"Macon-Bibb County, GA",Central,30,67700,1
2020-04-30,Pride Land Group Home,LLC,623990,Health Care and Social Assistance,Nursing and Residential Care Facilities,Other Residential Care Facilities ,U,U,U,N,2490 Heath Road,Macon,31201.0,13021,Bibb County,31420,"Macon-Bibb County, GA",Central,15,67500,1
2020-05-01,Royal Hospitality Group Inc,Chapter,721110,Accommodation and Food Services,Accommodation,Hotels (except Casino Hotels) and Motels ,U,Male Owned,Non-Veteran,N,2720 Riverside Dr,Macon,31201.0,13021,Bibb County,31420,"Macon-Bibb County, GA",Central,17,67430,1
2020-04-28,"C&H Bus Lines, Inc.",Corp,485510,Transportation and Warehousing,Transit and Ground Passenger Transportation,Charter Bus Industry,White,U,U,N,448 Pine St,Macon,31201.0,13021,Bibb County,31420,"Macon-Bibb County, GA",Central,23,67290,1
2020-04-28,"Billie L. Jackson, M.D., Llc",Corp,621111,Health Care and Social Assistance,Ambulatory Health Care Services,Offices of Physicians (except Mental Health Specialists) ,White,Male Owned,U,N,440 Charter Blvd,Macon,31201.0,13021,Bibb County,31420,"Macon-Bibb County, GA",Central,5,67000,1
2020-04-08,The Audio Zoo Inc,Corp,453998,Retail Trade,Miscellaneous Store Retailers,All Other Miscellaneous Store Retailers (except Tobacco Stores) ,Hispanic,Male Owned,Non-Veteran,N,4388 Mercer University Dr,Macon,31201.0,13021,Bibb County,31420,"Macon-Bibb County, GA",Central,9,67000,1
2020-04-09,"G 3 Timber, Llc",LLC,113110,"Agriculture, Forestry, Fishing and Hunting",Forestry and Logging,Timber Tract Operations,U,U,U,N,101 Devonshire Court,Forsyth,31029.0,13207,Monroe County,31420,"Macon-Bibb County, GA",Central,6,67000,1
2020-04-28,"Ingram & Associates Consulting Engineers, Llc",LLC,541330,"Professional, Scientific, and Technical Services","Professional, Scientific, and Technical Services",Engineering Services,U,U,U,N,332 New St,Macon,31201.0,13021,Bibb County,31420,"Macon-Bibb County, GA",Central,5,66764,1
2020-04-10,"Mox Timber Of Forsyth, Inc.",Chapter,113310,"Agriculture, Forestry, Fishing and Hunting",Forestry and Logging,Logging ,U,U,U,N,198-B Harold G Clarke Pkwy,Forsyth,31029.0,13207,Monroe County,31420,"Macon-Bibb County, GA",Central,8,66746,1
2020-04-11,Macon Georgia International Cherry Blossom Festival,Corp,711310,"Arts, Entertainment, and Recreation","Performing Arts, Spectator Sports, and Related Industries","Promoters of Performing Arts, Sports, and Similar Events with Facilities ",U,U,U,N,794 Cherry Street,Macon,31201.0,13021,Bibb County,31420,"Macon-Bibb County, GA",Central,6,66599,1
2020-05-13,"R.C. Poss, Llc",LLC,236220,Construction,Construction of Buildings,Commercial and Institutional Building Construction ,U,U,U,N,155 Franklin St,Macon,31201.0,13021,Bibb County,31420,"Macon-Bibb County, GA",Central,7,66471,1
2020-04-15,"Manufacturer'S Furniture Outlet Of Macon, Inc",Chapter,442110,Retail Trade,Furniture and Home Furnishings Stores,Furniture Stores ,U,U,U,N,2950 Riverside Dr,Macon,31201.0,13021,Bibb County,31420,"Macon-Bibb County, GA",Central,0,66400,1
2020-04-29,"Springer Medical Services, Inc.",Corp,621399,Health Care and Social Assistance,Ambulatory Health Care Services,Offices of All Other Miscellaneous Health Practitioners ,U,U,U,N,P. O. Box 4952 131 Red Fox Run,Macon,31201.0,13021,Bibb County,31420,"Macon-Bibb County, GA",Central,0,66300,1
2020-05-16,Presidential Transport Inc.,Chapter,484220,Transportation and Warehousing,Truck Transportation,"Specialized Freight (except Used Goods) Trucking, Local ",Black or African American,Male Owned,Non-Veteran,N,222 Jenna Court,Macon,31201.0,13021,Bibb County,31420,"Macon-Bibb County, GA",Central,10,66186,1
2020-04-28,"Piedmont Electrical Services, Inc",Corp,238210,Construction,Specialty Trade Contractors,Electrical Contractors and Other Wiring Installation Contractors,White,Male Owned,Non-Veteran,N,33 Forsyth Lndg Ct,Forsyth,31029.0,13207,Monroe County,31420,"Macon-Bibb County, GA",Central,8,66017,1
2020-04-12,"C And H Pools Of Macon, Llc",LLC,551112,Management of Companies and Enterprises,Management of Companies and Enterprises,Offices of Other Holding Companies ,U,Male Owned,Non-Veteran,N,515 Bartlett Street,Macon,31201.0,13021,Bibb County,31420,"Macon-Bibb County, GA",Central,8,66000,1
2020-05-01,Southern Trust Corporation,Corp,524210,Finance and Insurance,Insurance Carriers and Related Activities,Insurance Agencies and Brokerages ,U,U,U,N,5444 Riverside Drive,Macon,31201.0,13021,Bibb County,31420,"Macon-Bibb County, GA",Central,3,65578,1
2020-04-28,Macon Office Supplies Inc.,Corp,453210,Retail Trade,Miscellaneous Store Retailers,Office Supplies and Stationery Stores ,U,U,U,N,139 Woodfield Dr,Macon,31201.0,13021,Bibb County,31420,"Macon-Bibb County, GA",Central,7,65457,1
2020-04-11,"Bran Hospitality Forsyth, Inc",Chapter,721110,Accommodation and Food Services,Accommodation,Hotels (except Casino Hotels) and Motels ,White,Male Owned,Non-Veteran,N,"360 S, N Frontage Rd",Forsyth,31029.0,13207,Monroe County,31420,"Macon-Bibb County, GA",Central,18,65380,1
2020-04-07,Vision Surgery Center Llc,Chapter,621111,Health Care and Social Assistance,Ambulatory Health Care Services,Offices of Physicians (except Mental Health Specialists) ,U,U,U,N,4050 Riverside Dr,Macon,31201.0,13021,Bibb County,31420,"Macon-Bibb County, GA",Central,11,65300,1
2020-04-28,"Stringfellow & Paul Auto Sales, Inc.",Corp,441120,Retail Trade,Motor Vehicle and Parts Dealers,Used Car Dealers ,U,Male Owned,Non-Veteran,N,2910 Pio Nono Avenue,Macon,31201.0,13021,Bibb County,31420,"Macon-Bibb County, GA",Central,13,65000,1
2020-04-28,"Holliday Dental Associates, P.C.",Corp,621210,Health Care and Social Assistance,Ambulatory Health Care Services,Offices of Dentists ,U,Female Owned,Non-Veteran,N,360 Spring St,Macon,31201.0,13021,Bibb County,31420,"Macon-Bibb County, GA",Central,7,65000,1
2020-04-08,"Henderson Chemical, Llc",LLC,561720,Administrative and Support and Waste Management and Remediation Services,Administrative and Support Services,Janitorial Services ,U,U,U,N,820 Martin Luther King Jr Blvd,Macon,31201.0,13021,Bibb County,31420,"Macon-Bibb County, GA",Central,0,64900,1
2020-05-01,"Service First Transportation, Inc.",Corp,492110,Transportation and Warehousing,Couriers and Messengers,Couriers and Express Delivery Services,U,U,U,N,"116 Cross Creek Circle,",Macon,31201.0,13021,Bibb County,31420,"Macon-Bibb County, GA",Central,0,64500,1
2020-05-12,Central Georgia Internal Medicine Llc,LLC,621111,Health Care and Social Assistance,Ambulatory Health Care Services,Offices of Physicians (except Mental Health Specialists) ,U,U,U,N,640 1St Street,Macon,31201.0,13021,Bibb County,31420,"Macon-Bibb County, GA",Central,0,64062,1
2020-04-29,"Happy Sleep Nurse Anesthesia, Llc",LLC,621111,Health Care and Social Assistance,Ambulatory Health Care Services,Offices of Physicians (except Mental Health Specialists) ,U,Male Owned,Non-Veteran,N,577 Mulberry St,Macon,31201.0,13021,Bibb County,31420,"Macon-Bibb County, GA",Central,10,64000,1
2020-04-28,Joshua Buckner Dmd Llc,Corp,621210,Health Care and Social Assistance,Ambulatory Health Care Services,Offices of Dentists ,White,Male Owned,Non-Veteran,N,4562 Forsyth Rd,Macon,31201.0,13021,Bibb County,31420,"Macon-Bibb County, GA",Central,5,64000,1
2020-04-30,"Tommy Chancey Plumbing Co., Inc.",Chapter,238220,Construction,Specialty Trade Contractors,"Plumbing, Heating, and Air-Conditioning Contractors ",U,Male Owned,Non-Veteran,N,4394 Pio Nono Ave,Macon,31201.0,13021,Bibb County,31420,"Macon-Bibb County, GA",Central,9,63920,1
2020-04-15,"Superior Environmental Force, Llc",LLC,238990,Construction,Specialty Trade Contractors,All Other Specialty Trade Contractors,U,U,U,N,1411 Monticello Hwy,Gray,31032.0,13169,Jones County,31420,"Macon-Bibb County, GA",Central,5,63877,1
2020-06-03,A1 Auto Brokers Llc,Sole Oroprietor,423110,Wholesale Trade,"Merchant Wholesalers, Durable Goods",Automobile and Other Motor Vehicle Merchant Wholesalers ,U,U,U,N,152 New St,Macon,31201.0,13021,Bibb County,31420,"Macon-Bibb County, GA",Central,0,63870,1
2020-04-29,"Trees & More, Inc.",Chapter,561790,Administrative and Support and Waste Management and Remediation Services,Administrative and Support Services,Other Services to Buildings and Dwellings ,U,U,U,N,7726 East Hopewell Road,Musella,31066.0,13079,Crawford County,31420,"Macon-Bibb County, GA",West,8,63817,1
2020-04-29,Wade'S Auto Detail,Sole Oroprietor,811192,Other Services (except Public Administration),Repair and Maintenance,Car Washes ,U,U,U,N,3076 Napier Ave,Macon,31201.0,13021,Bibb County,31420,"Macon-Bibb County, GA",Central,21,63575,1
2020-05-01,New China Grill &Amp; Buffet Of Macon Inc,Corp,722511,Accommodation and Food Services,Food Services and Drinking Places,Full-Service Restaurants ,U,U,U,N,5056 Eisenhower Pkwy,Macon,31201.0,13021,Bibb County,31420,"Macon-Bibb County, GA",Central,12,63519,1
2020-04-09,"Sheets Insurance & Financial Services, Inc.",Chapter,524210,Finance and Insurance,Insurance Carriers and Related Activities,Insurance Agencies and Brokerages ,U,U,U,N,4130 Gray Hwy,Gray,31032.0,13169,Jones County,31420,"Macon-Bibb County, GA",Central,6,63500,1
2020-04-11,"Lillette A. Intaphan Md,Llc",Chapter,621111,Health Care and Social Assistance,Ambulatory Health Care Services,Offices of Physicians (except Mental Health Specialists) ,Asian,Female Owned,Non-Veteran,N,657 Hemlock St Ste 221,Macon,31201.0,13021,Bibb County,31420,"Macon-Bibb County, GA",Central,8,63482,1
2020-04-14,"Sadlers Casserole Shop, Llc",Corp,445291,Retail Trade,Food and Beverage Stores,Baked Goods Stores ,U,U,U,N,4420 Forsyth Rd,Macon,31201.0,13021,Bibb County,31420,"Macon-Bibb County, GA",Central,25,63468,1
2020-04-30,Harnist Services Inc,Chapter,443141,Retail Trade,Electronics and Appliance Stores,Household Appliance Stores ,U,U,U,N,2430 Industrial Park Dr,Macon,31201.0,13021,Bibb County,31420,"Macon-Bibb County, GA",Central,6,63345,1
2020-04-12,"Pinkney Gilchrist, Iv, Dmd, Llc",Corp,621210,Health Care and Social Assistance,Ambulatory Health Care Services,Offices of Dentists ,U,U,U,N,2971 Vineville Ave.,Macon,31201.0,13021,Bibb County,31420,"Macon-Bibb County, GA",Central,2,63332,1
2020-04-10,"Darman, Inc.",Corp,624410,Health Care and Social Assistance,Social Assistance,Child Day Care Services ,U,U,U,N,6625 Skipper Road,Macon,31201.0,13021,Bibb County,31420,"Macon-Bibb County, GA",Central,29,63267,1
2020-04-11,"Bowman Station, Llc",LLC,531311,Real Estate and Rental and Leasing,Real Estate,Residential Property Managers ,U,Male Owned,Non-Veteran,N,5402 New Forsyth Road,Macon,31201.0,13021,Bibb County,31420,"Macon-Bibb County, GA",Central,8,63022,1
2020-04-29,"C & H Pipeline, Inc",Corp,236115,Construction,Construction of Buildings,New Single-Family Housing Construction (except For-Sale Builders) ,U,U,U,N,45 Lakeview Drive,Roberta,31078.0,13079,Crawford County,31420,"Macon-Bibb County, GA",West,0,63000,1
2020-04-09,Run Fit Sports,Chapter,451110,Retail Trade,"Sporting Goods, Hobby, Musical Instrument, and Book Stores",Sporting Goods Stores ,U,U,U,N,4524 Forsyth Road,Macon,31201.0,13021,Bibb County,31420,"Macon-Bibb County, GA",Central,14,63000,1
2020-04-13,"Dynamic Mobile Dentistry, Llc",LLC,621210,Health Care and Social Assistance,Ambulatory Health Care Services,Offices of Dentists ,U,U,U,N,111 Grove Pointe Dr,Macon,31201.0,13021,Bibb County,31420,"Macon-Bibb County, GA",Central,5,62920,1
2020-04-28,Buice Enterprises Inc,Chapter,811111,Other Services (except Public Administration),Repair and Maintenance,General Automotive Repair ,U,U,U,N,40 Town Creek Road,Forsyth,31029.0,13207,Monroe County,31420,"Macon-Bibb County, GA",Central,5,62687,1
2020-04-30,Sagar Properties Inc,Corp,721110,Accommodation and Food Services,Accommodation,Hotels (except Casino Hotels) and Motels ,U,Male Owned,Non-Veteran,N,4630 Chambers Rd,Macon,31201.0,13021,Bibb County,31420,"Macon-Bibb County, GA",Central,19,62512,1
2020-04-28,"Ingleside Village Pizza, Inc.",Chapter,722511,Accommodation and Food Services,Food Services and Drinking Places,Full-Service Restaurants ,U,U,U,N,2395 Ingleside Ave,Macon,31201.0,13021,Bibb County,31420,"Macon-Bibb County, GA",Central,0,62500,1
2020-04-27,"Vineville Tire Company, Inc.",Corp,441320,Retail Trade,Motor Vehicle and Parts Dealers,Tire Dealers ,White,Male Owned,Non-Veteran,N,3253 Vineville Ave,Macon,31201.0,13021,Bibb County,31420,"Macon-Bibb County, GA",Central,7,62460,1
2020-04-15,Big Brothers Big Sisters Of The Heart,Prof. Assoc.,624110,Health Care and Social Assistance,Social Assistance,Child and Youth Services ,U,U,U,N,2720 Riverside Dr,Macon,31201.0,13021,Bibb County,31420,"Macon-Bibb County, GA",Central,6,62305,1
2020-05-06,Bmd Adrian Investco Llc,LLC,531311,Real Estate and Rental and Leasing,Real Estate,Residential Property Managers ,U,U,U,N,5243 Riverside Dr,Macon,31201.0,13021,Bibb County,31420,"Macon-Bibb County, GA",Central,0,62259,1
2020-06-03,Ffis Macon Hospitality Llc,Sole Oroprietor,721199,Accommodation and Food Services,Accommodation,All Other Traveler Accommodation ,U,Male Owned,U,N,4038 Sheraton Drive,Macon,31201.0,13021,Bibb County,31420,"Macon-Bibb County, GA",Central,90,62200,1
2020-04-27,"Jk Mobile Services, Llc",LLC,423120,Wholesale Trade,"Merchant Wholesalers, Durable Goods",Motor Vehicle Supplies and New Parts Merchant Wholesalers ,White,Male Owned,Non-Veteran,N,133 Harold G Clarke Pkwy,Forsyth,31029.0,13207,Monroe County,31420,"Macon-Bibb County, GA",Central,15,62100,1
2020-04-13,"Mc Macon Investco, Llc",Sole Oroprietor,488999,Transportation and Warehousing,Support Activities for Transportation,All Other Support Activities for Transportation ,U,U,U,N,6687 Skipper Road,Macon,31201.0,13021,Bibb County,31420,"Macon-Bibb County, GA",Central,5,62100,1
2020-04-27,Allegiant Anesthesia Llc,LLC,621111,Health Care and Social Assistance,Ambulatory Health Care Services,Offices of Physicians (except Mental Health Specialists) ,U,Male Owned,Non-Veteran,N,"577 Mulberry St, Suite 110",Macon,31201.0,13021,Bibb County,31420,"Macon-Bibb County, GA",Central,8,62002,1
2020-05-18,"Jb&L Auto Sales, Inc.",Corp,441120,Retail Trade,Motor Vehicle and Parts Dealers,Used Car Dealers ,U,U,U,N,4749 Houston Road,Macon,31201.0,13021,Bibb County,31420,"Macon-Bibb County, GA",Central,6,61954,1
2020-05-04,Anderson Walker And Reichert Llp,Partnership,541110,"Professional, Scientific, and Technical Services","Professional, Scientific, and Technical Services",Offices of Lawyers,U,Male Owned,U,N,577 Mulberry St Ste 1410,Macon,31201.0,13021,Bibb County,31420,"Macon-Bibb County, GA",Central,5,61794,1
2020-04-08,"J. Scott Memorials, Llc",LLC,453998,Retail Trade,Miscellaneous Store Retailers,All Other Miscellaneous Store Retailers (except Tobacco Stores) ,White,Male Owned,Non-Veteran,N,3256 Vineville Ave,Macon,31201.0,13021,Bibb County,31420,"Macon-Bibb County, GA",Central,9,61745,1
2020-04-13,"West Clinton Tire, Llc",LLC,441320,Retail Trade,Motor Vehicle and Parts Dealers,Tire Dealers ,U,U,U,N,4145 Gray Highway,Gray,31032.0,13169,Jones County,31420,"Macon-Bibb County, GA",Central,8,61700,1
2020-05-01,Zebulon Dental Center Llc,LLC,621210,Health Care and Social Assistance,Ambulatory Health Care Services,Offices of Dentists ,U,U,U,N,6443 Zebulon Rd Ste 3A,Macon,31201.0,13021,Bibb County,31420,"Macon-Bibb County, GA",Central,8,61670,1
2020-04-08,"Cabinetry By Evans, Inc.",Corp,337110,Manufacturing,Furniture and Related Product Manufacturing,Wood Kitchen Cabinet and Countertop Manufacturing,White,Male Owned,U,N,87 Industrial Park Rd,Roberta,31078.0,13079,Crawford County,31420,"Macon-Bibb County, GA",West,0,61611,1
2020-04-29,"Edwards & Bullard, Llp",LLP,541110,"Professional, Scientific, and Technical Services","Professional, Scientific, and Technical Services",Offices of Lawyers,U,Female Owned,Non-Veteran,N,3496 Vineville Ave,Macon,31201.0,13021,Bibb County,31420,"Macon-Bibb County, GA",Central,4,61500,1
2020-04-09,"Knapp-Barrs & Associates, Inc.",Corp,541110,"Professional, Scientific, and Technical Services","Professional, Scientific, and Technical Services",Offices of Lawyers,White,Male Owned,Non-Veteran,N,201 2Nd Street,Macon,31201.0,13021,Bibb County,31420,"Macon-Bibb County, GA",Central,8,61500,1
2020-04-10,"Steven C. Brewer, Cpa, Llc",LLC,541211,"Professional, Scientific, and Technical Services","Professional, Scientific, and Technical Services",Offices of Certified Public Accountants ,White,Male Owned,Non-Veteran,N,3725 Vineville Avenue,Macon,31201.0,13021,Bibb County,31420,"Macon-Bibb County, GA",Central,6,61444,1
