Date,Recipient,BusinessType,NAICS,Industry-2,Industry-3,Industry,RaceEthnicity,Gender,Veteran,NonProfit,Address,City,ZCTA,FIPS,County,CBSA,MSA,CDRegion,Jobs,Amount,Loans
2020-07-18,Cynthia S. Bostic,Sole Oroprietor,812990,Other Services (except Public Administration),Personal and Laundry Services,All Other Personal Services ,U,U,U,N,1490 Calhoun Street,Macon,31201.0,13021,Bibb County,31420,"Macon-Bibb County, GA",Central,0,12500,1
2020-04-27,Hartley Bridge 4017 Inc,Chapter,447110,Retail Trade,Gasoline Stations,Gasoline Stations with Convenience Stores ,Asian,Male Owned,Non-Veteran,N,4017 Hartley Bridge Rd,Macon,31201.0,13021,Bibb County,31420,"Macon-Bibb County, GA",Central,3,12500,1
2020-04-30,"Nutrition For Tomorrow Food Program, Inc.",Corp,722310,Accommodation and Food Services,Food Services and Drinking Places,Food Service Contractors,U,U,U,N,2778 Riverside Dr,Macon,31201.0,13021,Bibb County,31420,"Macon-Bibb County, GA",Central,0,12500,1
2020-04-07,Jyotsna Inc,Corp,445310,Retail Trade,Food and Beverage Stores,"Beer, Wine, and Liquor Stores ",U,U,U,N,701 Eisenhower Pkwy,Macon,31201.0,13021,Bibb County,31420,"Macon-Bibb County, GA",Central,0,12500,1
2020-04-28,Rinku And Dhaval Llc,LLC,447110,Retail Trade,Gasoline Stations,Gasoline Stations with Convenience Stores ,U,U,U,N,6398 Zebulon Rd,Macon,31201.0,13021,Bibb County,31420,"Macon-Bibb County, GA",Central,0,12500,1
2020-05-01,"La La Mart, Llc",LLC,447110,Retail Trade,Gasoline Stations,Gasoline Stations with Convenience Stores ,U,U,U,N,4437 Columbus Rd,Macon,31201.0,13021,Bibb County,31420,"Macon-Bibb County, GA",Central,2,12500,1
2020-04-28,"Jay 2015, Inc.",Chapter,445120,Retail Trade,Food and Beverage Stores,Convenience Stores ,U,U,U,N,1924 Forsyth St,Macon,31201.0,13021,Bibb County,31420,"Macon-Bibb County, GA",Central,0,12500,1
2020-05-01,Next Step Recovery Ministries,Non-Profit,621420,Health Care and Social Assistance,Ambulatory Health Care Services,Outpatient Mental Health and Substance Abuse Centers ,U,U,U,Y,6751 Houston Rd,Macon,31201.0,13021,Bibb County,31420,"Macon-Bibb County, GA",Central,4,12475,1
2020-05-01,"Rb Pressure Washing, Llc",LLC,561720,Administrative and Support and Waste Management and Remediation Services,Administrative and Support Services,Janitorial Services ,U,Male Owned,Non-Veteran,N,314 Horse Shoe Drive,Dry Branch,31020.0,13289,Twiggs County,31420,"Macon-Bibb County, GA",Central,2,12450,1
2020-04-27,Georgia Fleet Maintenance& Repair Llc,LLC,811118,Other Services (except Public Administration),Repair and Maintenance,Other Automotive Mechanical and Electrical Repair and Maintenance ,U,Male Owned,U,N,4160 Gray Hwy,Gray,31032.0,13169,Jones County,31420,"Macon-Bibb County, GA",Central,2,12400,1
2020-04-30,James D. Pendergrass  Lmft,Sole Oroprietor,621420,Health Care and Social Assistance,Ambulatory Health Care Services,Outpatient Mental Health and Substance Abuse Centers ,U,U,U,N,562 Saint Francis Street,Macon,31201.0,13021,Bibb County,31420,"Macon-Bibb County, GA",Central,1,12400,1
2020-04-27,"Creative Cutting, Llc",LLC,561730,Administrative and Support and Waste Management and Remediation Services,Administrative and Support Services,Landscaping Services,U,U,U,N,3636 Bonanza Drive,Macon,31201.0,13021,Bibb County,31420,"Macon-Bibb County, GA",Central,5,12381,1
2020-04-14,"Astro Pools, Inc.",Corp,713940,"Arts, Entertainment, and Recreation","Amusement, Gambling, and Recreation Industries",Fitness and Recreational Sports Centers ,U,U,U,N,3890 Lake Street,Macon,31201.0,13021,Bibb County,31420,"Macon-Bibb County, GA",Central,2,12365,1
2020-04-27,"Anytime Anywhere, Llc",Corp,488490,Transportation and Warehousing,Support Activities for Transportation,Other Support Activities for Road Transportation ,U,Male Owned,U,N,115 Old Stewart Rd.,Forsyth,31029.0,13207,Monroe County,31420,"Macon-Bibb County, GA",Central,4,12360,1
2020-05-08,Rita Walker,Sole Oroprietor,484121,Transportation and Warehousing,Truck Transportation,"General Freight Trucking, Long-Distance, Truckload ",U,U,U,N,210 Langston Avenue,Forsyth,31029.0,13207,Monroe County,31420,"Macon-Bibb County, GA",Central,2,12327,1
2020-06-19,Parker Landscape Management Inc,Chapter,561730,Administrative and Support and Waste Management and Remediation Services,Administrative and Support Services,Landscaping Services,U,U,U,N,346 Plentitude Church Road,Gray,31032.0,13169,Jones County,31420,"Macon-Bibb County, GA",Central,3,12305,1
2020-05-06,Michell Whitby Llc,LLC,812990,Other Services (except Public Administration),Personal and Laundry Services,All Other Personal Services ,U,U,U,N,267 Princess Ann Drive,Macon,31201.0,13021,Bibb County,31420,"Macon-Bibb County, GA",Central,0,12297,1
2020-06-29,"The W.B. Herring Agency, Inc",Corp,524210,Finance and Insurance,Insurance Carriers and Related Activities,Insurance Agencies and Brokerages ,U,U,U,N,871 Lee Rd,Macon,31201.0,13021,Bibb County,31420,"Macon-Bibb County, GA",Central,2,12293,1
2020-05-06,Country Manor Estate Llc,LLC,531390,Real Estate and Rental and Leasing,Real Estate,Other Activities Related to Real Estate ,U,U,U,N,1487 Allen Rd,Macon,31201.0,13021,Bibb County,31420,"Macon-Bibb County, GA",Central,4,12291,1
2020-04-27,Joe Mullendore,Sole Oroprietor,722511,Accommodation and Food Services,Food Services and Drinking Places,Full-Service Restaurants ,White,Male Owned,Non-Veteran,N,2329 Ingleside Avenue,Macon,31201.0,13021,Bibb County,31420,"Macon-Bibb County, GA",Central,3,12268,1
2020-07-31,Jonathansneed,Sole Oroprietor,484210,Transportation and Warehousing,Truck Transportation,Used Household and Office Goods Moving,U,Male Owned,U,N,4240 Cyndy Jo Circle,Macon,31201.0,13021,Bibb County,31420,"Macon-Bibb County, GA",Central,1,12265,1
2020-05-13,Taiwan Restaurant Inc,Corp,722513,Accommodation and Food Services,Food Services and Drinking Places,Limited-Service Restaurants ,U,U,U,N,2525 Pio Nono Ave Ste 250,Macon,31201.0,13021,Bibb County,31420,"Macon-Bibb County, GA",Central,4,12265,1
2020-04-15,Darberry Inc,Corp,448190,Retail Trade,Clothing and Clothing Accessories Stores,Other Clothing Stores ,U,U,U,N,2352 Ingleside Ave,Macon,31201.0,13021,Bibb County,31420,"Macon-Bibb County, GA",Central,7,12253,1
2020-06-05,Wright'S Basket Floral Decor,Sole Oroprietor,453110,Retail Trade,Miscellaneous Store Retailers,Florists ,U,U,U,N,321 Country Creek Rd,Macon,31201.0,13021,Bibb County,31420,"Macon-Bibb County, GA",Central,8,12250,1
2020-05-27,"Elmo A. Richardson, Jr., Pe, Llc",LLC,541330,"Professional, Scientific, and Technical Services","Professional, Scientific, and Technical Services",Engineering Services,U,U,U,N,"4875 Riverside Drive, Suite 101",Macon,31201.0,13021,Bibb County,31420,"Macon-Bibb County, GA",Central,0,12239,1
2020-05-05,"Wing Cafe, Inc.",Corp,722513,Accommodation and Food Services,Food Services and Drinking Places,Limited-Service Restaurants ,Asian,Female Owned,Non-Veteran,N,399 Plantation Way,Macon,31201.0,13021,Bibb County,31420,"Macon-Bibb County, GA",Central,4,12227,1
2020-07-13,Intec Engineering Inc,Corp,541330,"Professional, Scientific, and Technical Services","Professional, Scientific, and Technical Services",Engineering Services,U,U,U,N,6233 Ga Highway 87,Macon,31201.0,13021,Bibb County,31420,"Macon-Bibb County, GA",Central,2,12221,1
2020-04-27,Sai Shakti Creamery Inc,Chapter,722513,Accommodation and Food Services,Food Services and Drinking Places,Limited-Service Restaurants ,U,U,U,N,5976 Zebulon Road,Macon,31201.0,13021,Bibb County,31420,"Macon-Bibb County, GA",Central,6,12200,1
2020-04-29,C R Rader Company,Corp,448310,Retail Trade,Clothing and Clothing Accessories Stores,Jewelry Stores ,U,U,U,N,667 Cherry Street,Macon,31201.0,13021,Bibb County,31420,"Macon-Bibb County, GA",Central,4,12200,1
2020-04-13,West Mane Salon,Corp,812111,Other Services (except Public Administration),Personal and Laundry Services,Barber Shops ,U,U,U,N,18 West Main St,Forsyth,31029.0,13207,Monroe County,31420,"Macon-Bibb County, GA",Central,2,12200,1
2020-04-08,Kvp Llc,LLC,447110,Retail Trade,Gasoline Stations,Gasoline Stations with Convenience Stores ,U,U,U,N,1592 Forest Hill Rd,Macon,31201.0,13021,Bibb County,31420,"Macon-Bibb County, GA",Central,5,12200,1
2020-05-14,"Southern Paws Boarding And Daycare, Llc",LLC,541990,"Professional, Scientific, and Technical Services","Professional, Scientific, and Technical Services","All Other Professional, Scientific, and Technical Services",U,Female Owned,U,N,3910 South Walden Road,Macon,31201.0,13021,Bibb County,31420,"Macon-Bibb County, GA",Central,4,12195,1
2020-04-28,Howard Hightower,Sole Oroprietor,524210,Finance and Insurance,Insurance Carriers and Related Activities,Insurance Agencies and Brokerages ,White,Male Owned,Veteran,N,5960 Zebulon Rd,Macon,31201.0,13021,Bibb County,31420,"Macon-Bibb County, GA",Central,2,12194,1
2020-04-28,United Wmsw Macon Llc,Corp,722511,Accommodation and Food Services,Food Services and Drinking Places,Full-Service Restaurants ,U,Male Owned,Non-Veteran,N,1401 Gray Hwy,Macon,31201.0,13021,Bibb County,31420,"Macon-Bibb County, GA",Central,3,12192,1
2020-04-15,"Ttt & J, Llc",LLC,453998,Retail Trade,Miscellaneous Store Retailers,All Other Miscellaneous Store Retailers (except Tobacco Stores) ,U,U,U,N,5451 Bowman Road,Macon,31201.0,13021,Bibb County,31420,"Macon-Bibb County, GA",Central,3,12151,1
2020-04-30,Retirement Solutions Of Ga Llc,LLC,541611,"Professional, Scientific, and Technical Services","Professional, Scientific, and Technical Services",Administrative Management and General Management Consulting Services ,U,U,U,N,4875 Riverside Dr Suite 109,Macon,31201.0,13021,Bibb County,31420,"Macon-Bibb County, GA",Central,1,12130,1
2020-05-02,"M C Deliverys, Llc",LLC,811310,Other Services (except Public Administration),Repair and Maintenance,Commercial and Industrial Machinery and Equipment (except Automotive and Electronic) Repair and Maintenance ,U,U,U,N,5784 Ga Highway 42 N,Forsyth,31029.0,13207,Monroe County,31420,"Macon-Bibb County, GA",Central,2,12123,1
2020-04-28,Sachin Property Llc,LLC,447110,Retail Trade,Gasoline Stations,Gasoline Stations with Convenience Stores ,U,U,U,N,4961 Romeiser Dr,Macon,31201.0,13021,Bibb County,31420,"Macon-Bibb County, GA",Central,0,12100,1
2020-04-27,"Guardian Medical Services, Llc",Partnership,811490,Other Services (except Public Administration),Repair and Maintenance,Other Personal and Household Goods Repair and Maintenance ,U,Male Owned,U,N,1001 Jenkins Rd,Forsyth,31029.0,13207,Monroe County,31420,"Macon-Bibb County, GA",Central,1,12099,1
2020-07-21,We Party 2,Self-Employed,711320,"Arts, Entertainment, and Recreation","Performing Arts, Spectator Sports, and Related Industries","Promoters of Performing Arts, Sports, and Similar Events without Facilities ",U,U,U,N,1482 New Castle Dr,Macon,31201.0,13021,Bibb County,31420,"Macon-Bibb County, GA",Central,1,12088,1
2020-06-23,Trey Brown Enterprises,LLC,812990,Other Services (except Public Administration),Personal and Laundry Services,All Other Personal Services ,U,U,U,N,7231 Ga Hwy 42 South,Culloden,31016.0,13207,Monroe County,31420,"Macon-Bibb County, GA",Central,1,12047,1
2020-04-27,Weeping Willow Llc,LLC,444220,Retail Trade,Building Material and Garden Equipment and Supplies Dealers,"Nursery, Garden Center, and Farm Supply Stores ",U,U,U,N,107 Railroad St,Gray,31032.0,13169,Jones County,31420,"Macon-Bibb County, GA",Central,3,12043,1
2020-04-29,Rjm Capital Llc,LLC,722511,Accommodation and Food Services,Food Services and Drinking Places,Full-Service Restaurants ,U,U,U,N,370 Cherry Street,Macon,31201.0,13021,Bibb County,31420,"Macon-Bibb County, GA",Central,0,12032,1
2020-04-07,"Ct Wireless M1, Inc.",Corp,517312,Information,Telecommunications,Wireless Telecommunications Carriers (except Satellite),Asian,Male Owned,Non-Veteran,N,1548 Rocky Creek Road,Macon,31201.0,13021,Bibb County,31420,"Macon-Bibb County, GA",Central,2,12000,1
2020-04-09,"Allstate Sealcoating & Striping, L.L.C.",LLC,238990,Construction,Specialty Trade Contractors,All Other Specialty Trade Contractors,U,U,U,N,4190 Plaudit Rd,Lizella,31052.0,13021,Bibb County,31420,"Macon-Bibb County, GA",Central,3,12000,1
2020-05-04,Hide N Seek Learning Center,LLC,624410,Health Care and Social Assistance,Social Assistance,Child Day Care Services ,U,Male Owned,U,N,3225 Pio Nono Ave,Macon,31201.0,13021,Bibb County,31420,"Macon-Bibb County, GA",Central,0,11993,1
2020-04-28,"Super Storage Partners, Llc",LLC,531110,Real Estate and Rental and Leasing,Real Estate,Lessors of Residential Buildings and Dwellings ,U,U,U,N,1985 Gray Hwy,Macon,31201.0,13021,Bibb County,31420,"Macon-Bibb County, GA",Central,0,11966,1
2020-05-29,Macons Dueling Piano Bar Llc,LLC,722410,Accommodation and Food Services,Food Services and Drinking Places,Drinking Places (Alcoholic Beverages) ,U,U,U,N,570 Mulberry Street,Macon,31201.0,13021,Bibb County,31420,"Macon-Bibb County, GA",Central,7,11885,1
2020-05-01,Hidden Paradise Farm,Self-Employed,112920,"Agriculture, Forestry, Fishing and Hunting",Animal Production and Aquaculture,Horses and Other Equine Production,U,U,U,N,321 Mccallum Pl,Lizella,31052.0,13021,Bibb County,31420,"Macon-Bibb County, GA",Central,4,11863,1
2020-04-27,"D & D Landscaping, Llc",LLC,561730,Administrative and Support and Waste Management and Remediation Services,Administrative and Support Services,Landscaping Services,U,U,U,N,105 Brown Dr,Macon,31201.0,13021,Bibb County,31420,"Macon-Bibb County, GA",Central,2,11854,1
2020-05-01,G&R Transport,Sole Oroprietor,488510,Transportation and Warehousing,Support Activities for Transportation,Freight Transportation Arrangement ,U,U,U,N,4438 Ashland Dr,Macon,31201.0,13021,Bibb County,31420,"Macon-Bibb County, GA",Central,1,11844,1
2020-04-29,Jrs Babydoll Trucking Llc,Sole Oroprietor,484121,Transportation and Warehousing,Truck Transportation,"General Freight Trucking, Long-Distance, Truckload ",U,U,U,N,830 Ethridge Rd,Haddock,31033.0,13169,Jones County,31420,"Macon-Bibb County, GA",Central,1,11800,1
2020-06-04,Bapaforever 2030 Inc,Corp,447110,Retail Trade,Gasoline Stations,Gasoline Stations with Convenience Stores ,U,U,U,N,3198 Mercer University Dr,Macon,31201.0,13021,Bibb County,31420,"Macon-Bibb County, GA",Central,2,11800,1
2020-07-27,Chappell Traynham,Sole Oroprietor,561599,Administrative and Support and Waste Management and Remediation Services,Administrative and Support Services,All Other Travel Arrangement and Reservation Services ,U,U,U,N,"715, Glen Merry Blvd",Macon,31201.0,13021,Bibb County,31420,"Macon-Bibb County, GA",Central,1,11800,1
2020-04-30,Hong Kong Palace,Corp,722513,Accommodation and Food Services,Food Services and Drinking Places,Limited-Service Restaurants ,U,U,U,N,465 Tift College Dr,Forsyth,31029.0,13207,Monroe County,31420,"Macon-Bibb County, GA",Central,2,11740,1
2020-04-10,Ainsley R Hall,Contractor,531320,Real Estate and Rental and Leasing,Real Estate,Offices of Real Estate Appraisers ,White,Female Owned,Non-Veteran,N,93 E Main St,Forsyth,31029.0,13207,Monroe County,31420,"Macon-Bibb County, GA",Central,1,11735,1
2020-05-01,Middle Georgia Aquatics Inc,Non-Profit,611620,Educational Services,Educational Services,Sports and Recreation Instruction ,U,U,U,Y,5097 Northside Dr,Macon,31201.0,13021,Bibb County,31420,"Macon-Bibb County, GA",Central,2,11703,1
2020-04-11,"M-Squared Resources, Llc",LLC,561320,Administrative and Support and Waste Management and Remediation Services,Administrative and Support Services,Temporary Help Services,U,U,U,N,2881 S. Estates Road,Macon,31201.0,13021,Bibb County,31420,"Macon-Bibb County, GA",Central,4,11700,1
2020-04-28,"Home Services Of Macon, Llc",LLC,561720,Administrative and Support and Waste Management and Remediation Services,Administrative and Support Services,Janitorial Services ,U,U,U,N,2973 Nowell Dr,Macon,31201.0,13021,Bibb County,31420,"Macon-Bibb County, GA",Central,3,11683,1
2020-04-29,"Jane Pennington Insurance Agency, Inc.",Chapter,524210,Finance and Insurance,Insurance Carriers and Related Activities,Insurance Agencies and Brokerages ,U,Female Owned,U,N,57 South Lee St,Forsyth,31029.0,13207,Monroe County,31420,"Macon-Bibb County, GA",Central,2,11650,1
2020-05-15,"Aspiring Intelligent Minds, Llc",LLC,611691,Educational Services,Educational Services,Exam Preparation and Tutoring ,U,U,U,N,1200B Northside Crossing,Macon,31201.0,13021,Bibb County,31420,"Macon-Bibb County, GA",Central,5,11627,1
2020-05-07,Jhjh Llc,Chapter,453998,Retail Trade,Miscellaneous Store Retailers,All Other Miscellaneous Store Retailers (except Tobacco Stores) ,U,U,U,N,6199 Thomaston Rd,Macon,31201.0,13021,Bibb County,31420,"Macon-Bibb County, GA",Central,4,11607,1
2020-04-28,"Dhruva 2018, Llc",LLC,447110,Retail Trade,Gasoline Stations,Gasoline Stations with Convenience Stores ,U,U,U,N,4224 Bloomfield Rd,Macon,31201.0,13021,Bibb County,31420,"Macon-Bibb County, GA",Central,0,11600,1
2020-06-18,Linda Walker,Self-Employed,812990,Other Services (except Public Administration),Personal and Laundry Services,All Other Personal Services ,U,U,U,N,3363 Woodcrest Road,Macon,31201.0,13021,Bibb County,31420,"Macon-Bibb County, GA",Central,0,11582,1
2020-04-15,Marsha Pruitt,Sole Oroprietor,812199,Other Services (except Public Administration),Personal and Laundry Services,Other Personal Care Services ,U,U,U,N,5555 Donnan Rd,Macon,31201.0,13021,Bibb County,31420,"Macon-Bibb County, GA",Central,1,11545,1
2020-04-30,Michael Anottingham,Sole Oroprietor,484220,Transportation and Warehousing,Truck Transportation,"Specialized Freight (except Used Goods) Trucking, Local ",U,Male Owned,U,N,2800 Lakeshore Dr Apt 2780,Macon,31201.0,13021,Bibb County,31420,"Macon-Bibb County, GA",Central,1,11542,1
2020-04-05,"H. Davis Trucking, Llc",LLC,484110,Transportation and Warehousing,Truck Transportation,"General Freight Trucking, Local ",U,U,U,N,205 Jackson Lindsey Rd,Forsyth,31029.0,13207,Monroe County,31420,"Macon-Bibb County, GA",Central,1,11530,1
2020-07-24,Charity Gattis,Contractor,485310,Transportation and Warehousing,Transit and Ground Passenger Transportation,Taxi Service ,U,U,U,N,908 Ashlin Avenue,Macon,31201.0,13021,Bibb County,31420,"Macon-Bibb County, GA",Central,1,11528,1
2020-04-28,Jason M. Orenstein P. C.,Corp,541110,"Professional, Scientific, and Technical Services","Professional, Scientific, and Technical Services",Offices of Lawyers,U,Male Owned,Non-Veteran,N,1922 Forsyth St,Macon,31201.0,13021,Bibb County,31420,"Macon-Bibb County, GA",Central,1,11500,1
2020-05-08,Happy Trails Learning Center,LLC,611699,Educational Services,Educational Services,All Other Miscellaneous Schools and Instruction ,U,U,U,N,2882 Vineville Ave,Macon,31201.0,13021,Bibb County,31420,"Macon-Bibb County, GA",Central,2,11500,1
2020-06-03,Alford'S Do It All Llc,Self-Employed,238220,Construction,Specialty Trade Contractors,"Plumbing, Heating, and Air-Conditioning Contractors ",U,U,U,N,4212 Trammell Ave,Macon,31201.0,13021,Bibb County,31420,"Macon-Bibb County, GA",Central,1,11494,1
2020-05-12,Timberland Management And Realty Llc,LLC,115310,"Agriculture, Forestry, Fishing and Hunting",Support Activities for Agriculture and Forestry,Support Activities for Forestry,U,U,U,N,923 High Street,Macon,31201.0,13021,Bibb County,31420,"Macon-Bibb County, GA",Central,1,11458,1
2020-04-29,"Elite Apothecary Services, Llc",LLC,446110,Retail Trade,Health and Personal Care Stores,Pharmacies and Drug Stores ,U,U,U,N,5300 Bowman Road,Macon,31201.0,13021,Bibb County,31420,"Macon-Bibb County, GA",Central,2,11432,1
2020-04-27,Rsk Bar Llc,LLC,722511,Accommodation and Food Services,Food Services and Drinking Places,Full-Service Restaurants ,Asian,Male Owned,Non-Veteran,N,3852 Northside Dr,Macon,31201.0,13021,Bibb County,31420,"Macon-Bibb County, GA",Central,5,11425,1
2020-04-13,"The Powell Agency, Inc.",Corp,524210,Finance and Insurance,Insurance Carriers and Related Activities,Insurance Agencies and Brokerages ,U,U,U,N,3298 Vineville Avenue,Macon,31201.0,13021,Bibb County,31420,"Macon-Bibb County, GA",Central,3,11400,1
2020-05-02,Netrock Technologies Llc,LLC,541512,"Professional, Scientific, and Technical Services","Professional, Scientific, and Technical Services",Computer Systems Design Services ,U,U,U,N,205 Albermarle Place,Macon,31201.0,13021,Bibb County,31420,"Macon-Bibb County, GA",Central,1,11400,1
2020-04-28,"Greene'S Landscapes Of Gary, Georgia Llc",LLC,541990,"Professional, Scientific, and Technical Services","Professional, Scientific, and Technical Services","All Other Professional, Scientific, and Technical Services",U,U,U,N,758 Greene Settlement Rd,Gray,31032.0,13169,Jones County,31420,"Macon-Bibb County, GA",Central,1,11366,1
2020-04-28,Elizabeth Ashley Clark,Contractor,332211,,,,U,U,U,N,1326 King Arthur Drive,Macon,31201.0,13021,Bibb County,31420,"Macon-Bibb County, GA",Central,1,11340,1
2020-06-24,Bp&Sons Enterprises Inc,Corp,447110,Retail Trade,Gasoline Stations,Gasoline Stations with Convenience Stores ,U,U,U,N,1179 Eisenhower Pkwy,Macon,31201.0,13021,Bibb County,31420,"Macon-Bibb County, GA",Central,3,11300,1
2020-05-01,Kaiser Gerhardt,Sole Oroprietor,0,,,,U,U,U,N,2576 Elizabeth Pl,Macon,31201.0,13021,Bibb County,31420,"Macon-Bibb County, GA",Central,1,11284,1
2020-06-23,Maya Hart,Self-Employed,812111,Other Services (except Public Administration),Personal and Laundry Services,Barber Shops ,U,U,U,N,100 Worsham Lane,Jeffersonville,31044.0,13289,Twiggs County,31420,"Macon-Bibb County, GA",Central,1,11268,1
2020-05-01,"Whitley Holdings, Inc.",Corp,811420,Other Services (except Public Administration),Repair and Maintenance,Reupholstery and Furniture Repair,U,U,U,N,4048 475 Industrial Blvd.,Macon,31201.0,13021,Bibb County,31420,"Macon-Bibb County, GA",Central,2,11257,1
2020-06-04,Impact Fitness,Self-Employed,713940,"Arts, Entertainment, and Recreation","Amusement, Gambling, and Recreation Industries",Fitness and Recreational Sports Centers ,U,U,U,N,340 Second St.,Macon,31201.0,13021,Bibb County,31420,"Macon-Bibb County, GA",Central,1,11252,1
2020-05-04,Shannon Enterprises,Sole Oroprietor,541330,"Professional, Scientific, and Technical Services","Professional, Scientific, and Technical Services",Engineering Services,U,U,U,N,500 Ferncliff Terrace,Macon,31201.0,13021,Bibb County,31420,"Macon-Bibb County, GA",Central,0,11250,1
2020-06-30,Pamela Andersen Cleaning,Sole Oroprietor,561720,Administrative and Support and Waste Management and Remediation Services,Administrative and Support Services,Janitorial Services ,U,U,U,N,"8289 Hamlin St , Lizella, Ga, 31052",Lizella,31052.0,13021,Bibb County,31420,"Macon-Bibb County, GA",Central,2,11250,1
2020-05-01,Area51Seo Llc,LLC,999990,,,,U,U,U,N,4811 Guerry Dr,Macon,31201.0,13021,Bibb County,31420,"Macon-Bibb County, GA",Central,4,11250,1
2020-04-07,Bluemoon Macon Llc,LLC,445310,Retail Trade,Food and Beverage Stores,"Beer, Wine, and Liquor Stores ",U,U,U,N,2238 Pio Nono Ave,Macon,31201.0,13021,Bibb County,31420,"Macon-Bibb County, GA",Central,0,11250,1
2020-05-05,Posh Clothiers Llc,LLC,448120,Retail Trade,Clothing and Clothing Accessories Stores,Women's Clothing Stores ,U,U,U,N,5080 Riverside Drive,Macon,31201.0,13021,Bibb County,31420,"Macon-Bibb County, GA",Central,6,11240,1
2020-04-14,Hr 24 Enterprise Inc,Corp,447110,Retail Trade,Gasoline Stations,Gasoline Stations with Convenience Stores ,U,U,U,N,3484 Napier Ave,Macon,31201.0,13021,Bibb County,31420,"Macon-Bibb County, GA",Central,3,11200,1
2020-04-08,"Bliss Hospitality, Llc",LLC,721110,Accommodation and Food Services,Accommodation,Hotels (except Casino Hotels) and Motels ,U,U,U,N,150 Plantation Inn Dr,Macon,31201.0,13021,Bibb County,31420,"Macon-Bibb County, GA",Central,0,11200,1
2020-04-15,"Barber Forest Consultants, Inc.",Sole Oroprietor,453998,Retail Trade,Miscellaneous Store Retailers,All Other Miscellaneous Store Retailers (except Tobacco Stores) ,U,Male Owned,Non-Veteran,N,37 Country Place,Macon,31201.0,13021,Bibb County,31420,"Macon-Bibb County, GA",Central,1,11200,1
2020-05-05,Suzanne Kimbell Pieri,Sole Oroprietor,561492,Administrative and Support and Waste Management and Remediation Services,Administrative and Support Services,Court Reporting and Stenotype Services ,U,U,U,N,1818 Ga Hwy 42 N,Forsyth,31029.0,13207,Monroe County,31420,"Macon-Bibb County, GA",Central,1,11195,1
2020-04-27,"Travis Jean Emporium, Llc",LLC,453220,Retail Trade,Miscellaneous Store Retailers,"Gift, Novelty, and Souvenir Stores ",U,U,U,N,522 Cherry Street,Macon,31201.0,13021,Bibb County,31420,"Macon-Bibb County, GA",Central,3,11160,1
2020-05-18,Fit Moguls Llc,LLC,713940,"Arts, Entertainment, and Recreation","Amusement, Gambling, and Recreation Industries",Fitness and Recreational Sports Centers ,U,U,U,N,371 Second Street,Macon,31201.0,13021,Bibb County,31420,"Macon-Bibb County, GA",Central,2,11130,1
2020-04-28,Pinebrook Bottle Shop Llc,LLC,445310,Retail Trade,Food and Beverage Stores,"Beer, Wine, and Liquor Stores ",U,Male Owned,U,N,4448 Forsyth Rd,Macon,31201.0,13021,Bibb County,31420,"Macon-Bibb County, GA",Central,2,11118,1
2020-04-28,Dear Management Llc,LLC,721110,Accommodation and Food Services,Accommodation,Hotels (except Casino Hotels) and Motels ,Asian,Male Owned,Non-Veteran,N,320 Cabiness Rd,Forsyth,31029.0,13207,Monroe County,31420,"Macon-Bibb County, GA",Central,4,11100,1
2020-04-28,Candy Taylor Insurance Agency Llc,LLC,524210,Finance and Insurance,Insurance Carriers and Related Activities,Insurance Agencies and Brokerages ,U,U,U,N,4126 Hartley Bridge Rd,Macon,31201.0,13021,Bibb County,31420,"Macon-Bibb County, GA",Central,1,11081,1
2020-04-30,Beesa Skincare Llc,LLC,611511,Educational Services,Educational Services,Cosmetology and Barber Schools ,U,U,U,N,2484 Ingleside Ave Building A Suite 101-B,Macon,31201.0,13021,Bibb County,31420,"Macon-Bibb County, GA",Central,1,11075,1
2020-04-28,Wet Pets Inc,Corp,453910,Retail Trade,Miscellaneous Store Retailers,Pet and Pet Supplies Stores ,U,U,U,N,605 Chapman Rd,Macon,31201.0,13021,Bibb County,31420,"Macon-Bibb County, GA",Central,2,11058,1
