Date,Recipient,BusinessType,NAICS,Industry-2,Industry-3,Industry,RaceEthnicity,Gender,Veteran,NonProfit,Address,City,ZCTA,FIPS,County,CBSA,MSA,CDRegion,Jobs,Amount,Loans
2020-04-08,Kamin Llc,LLC,327992,Manufacturing,Nonmetallic Mineral Product Manufacturing,Ground or Treated Mineral and Earth Manufacturing ,U,U,U,N,822 Huber Rd,Macon,31201.0,13021,Bibb County,31420,"Macon-Bibb County, GA",Central,30,6387877,1
2020-04-10,Macon Orthopaedic And Hand Center Pa,Corp,621111,Health Care and Social Assistance,Ambulatory Health Care Services,Offices of Physicians (except Mental Health Specialists) ,U,U,U,N,3708 Northside Dr,Macon,31201.0,13021,Bibb County,31420,"Macon-Bibb County, GA",Central,407,4840457,1
2020-04-28,Cherokee Brick & Tile Company,Corp,327120,Manufacturing,Nonmetallic Mineral Product Manufacturing,Clay Building Material and Refractories Manufacturing ,U,Male Owned,Non-Veteran,N,3250 Waterville Road,Macon,31201.0,13021,Bibb County,31420,"Macon-Bibb County, GA",Central,230,4638000,1
2020-04-13,"Goodwill Industries Of Middle Georgia, Inc.",Non-Profit,453310,Retail Trade,Miscellaneous Store Retailers,Used Merchandise Stores ,U,U,U,Y,"5171 Eisenhower Parkway,",Macon,31201.0,13021,Bibb County,31420,"Macon-Bibb County, GA",Central,486,4598000,1
2020-04-07,B&D Industrial Inc.,Corp,423840,Wholesale Trade,"Merchant Wholesalers, Durable Goods",Industrial Supplies Merchant Wholesalers,U,U,U,N,Po Box 4325,Macon,31201.0,13021,Bibb County,31420,"Macon-Bibb County, GA",Central,284,4193295,1
2020-04-15,Blazer Holdings Llc,LLC,811310,Other Services (except Public Administration),Repair and Maintenance,Commercial and Industrial Machinery and Equipment (except Automotive and Electronic) Repair and Maintenance ,U,U,U,N,200 Cherry St,Macon,31201.0,13021,Bibb County,31420,"Macon-Bibb County, GA",Central,189,2900000,1
2020-04-14,Progressive Communications Llc,LLC,541519,"Professional, Scientific, and Technical Services","Professional, Scientific, and Technical Services",Other Computer Related Services,White,Male Owned,U,N,300 Mulberry St,Macon,31201.0,13021,Bibb County,31420,"Macon-Bibb County, GA",Central,182,2720300,1
2020-04-09,"Radiology Associates Of Macon, P.C.",Corp,621111,Health Care and Social Assistance,Ambulatory Health Care Services,Offices of Physicians (except Mental Health Specialists) ,U,U,U,N,770 Pine St Ste 290,Macon,31201.0,13021,Bibb County,31420,"Macon-Bibb County, GA",Central,122,2401043,1
2020-04-11,Lowe Electric Supply Company,Chapter,423610,Wholesale Trade,"Merchant Wholesalers, Durable Goods","Electrical Apparatus and Equipment, Wiring Supplies, and Related Equipment Merchant Wholesalers ",U,U,U,N,1525 Forsyth St,Macon,31201.0,13021,Bibb County,31420,"Macon-Bibb County, GA",Central,163,2096854,1
2020-04-14,James Bates Brannan Groover Llp,LLP,541110,"Professional, Scientific, and Technical Services","Professional, Scientific, and Technical Services",Offices of Lawyers,U,U,U,N,231 Riverside Dr,Macon,31201.0,13021,Bibb County,31420,"Macon-Bibb County, GA",Central,110,2077800,1
2020-04-15,Wesleyan College,Corp,611310,Educational Services,Educational Services,"Colleges, Universities, and Professional Schools ",U,U,U,N,4760 Forsyth Rd,Macon,31201.0,13021,Bibb County,31420,"Macon-Bibb County, GA",Central,261,1923500,1
2020-04-04,Beaver Creek Homes Llc,LLC,541211,"Professional, Scientific, and Technical Services","Professional, Scientific, and Technical Services",Offices of Certified Public Accountants ,U,U,U,N,389 Mulberry Street,Macon,31201.0,13021,Bibb County,31420,"Macon-Bibb County, GA",Central,120,1861500,1
2020-04-07,"Five Star Dodge, Inc.",Corp,441110,Retail Trade,Motor Vehicle and Parts Dealers,New Car Dealers ,U,Male Owned,U,N,3068 Riverside Dr,Macon,31201.0,13021,Bibb County,31420,"Macon-Bibb County, GA",Central,145,1692300,1
2020-04-13,Lintech International Llc,LLC,424690,Wholesale Trade,"Merchant Wholesalers, Nondurable Goods",Other Chemical and Allied Products Merchant Wholesalers ,U,U,U,N,7705 Ne Industrial Blvd,Macon,31201.0,13021,Bibb County,31420,"Macon-Bibb County, GA",Central,79,1609600,1
2020-04-07,"Stratford Academy, Inc.",Non-Profit,611110,Educational Services,Educational Services,Elementary and Secondary Schools ,U,U,U,Y,6010 Peake Rd,Macon,31201.0,13021,Bibb County,31420,"Macon-Bibb County, GA",Central,150,1604072,1
2020-04-11,Gm Butler Inc,Corp,441310,Retail Trade,Motor Vehicle and Parts Dealers,Automotive Parts and Accessories Stores ,U,U,U,N,4580 Riverside Dr,Macon,31201.0,13021,Bibb County,31420,"Macon-Bibb County, GA",Central,137,1580400,1
2020-04-14,Riverside Ford Inc,Corp,441110,Retail Trade,Motor Vehicle and Parts Dealers,New Car Dealers ,U,U,U,N,2089 Riverside Drive,Macon,31201.0,13021,Bibb County,31420,"Macon-Bibb County, GA",Central,159,1579500,1
2020-04-09,"Affordable Business Solutions, Inc.",Non-Profit,561499,Administrative and Support and Waste Management and Remediation Services,Administrative and Support Services,All Other Business Support Services ,U,U,U,Y,175 Emery Highway,Macon,31201.0,13021,Bibb County,31420,"Macon-Bibb County, GA",Central,246,1548400,1
2020-04-12,Georgia Right-Of-Way Company,Cooperative,561730,Administrative and Support and Waste Management and Remediation Services,Administrative and Support Services,Landscaping Services,U,U,U,N,60 Logistics Center Parkway,Forsyth,31029.0,13207,Monroe County,31420,"Macon-Bibb County, GA",Central,155,1521400,1
2020-04-28,"Macon Bibb County Economic Opportunity Council, Inc.",Non-Profit,624410,Health Care and Social Assistance,Social Assistance,Child Day Care Services ,Black or African American,Female Owned,Non-Veteran,Y,1680 Broadway,Macon,31201.0,13021,Bibb County,31420,"Macon-Bibb County, GA",Central,200,1496930,1
2020-04-10,"Central Georgia Heart Center, P.C.",Chapter,621111,Health Care and Social Assistance,Ambulatory Health Care Services,Offices of Physicians (except Mental Health Specialists) ,Black or African American,Male Owned,U,N,1062 Forsyth St,Macon,31201.0,13021,Bibb County,31420,"Macon-Bibb County, GA",Central,137,1467500,1
2020-04-16,"New S&S Cafeterias, Llc",LLC,722310,Accommodation and Food Services,Food Services and Drinking Places,Food Service Contractors,U,U,U,N,3402 Vineville Ave,Macon,31201.0,13021,Bibb County,31420,"Macon-Bibb County, GA",Central,330,1421975,1
2020-06-24,Triangle Chemical Company,Chapter,424690,Wholesale Trade,"Merchant Wholesalers, Nondurable Goods",Other Chemical and Allied Products Merchant Wholesalers ,U,U,U,N,117 Preston Court,Macon,31201.0,13021,Bibb County,31420,"Macon-Bibb County, GA",Central,231,1400000,1
2020-04-13,"Forest Resource Consultants, Inc.",Chapter,115310,"Agriculture, Forestry, Fishing and Hunting",Support Activities for Agriculture and Forestry,Support Activities for Forestry,White,Male Owned,Non-Veteran,N,964 Georgia Ave,Macon,31201.0,13021,Bibb County,31420,"Macon-Bibb County, GA",Central,108,1394500,1
2020-05-02,Academy For Classical Education Inc,Non-Profit,923110,Public Administration,Administration of Human Resource Programs,Administration of Education Programs ,U,U,U,Y,5665 New Forsyth Rd,Macon,31201.0,13021,Bibb County,31420,"Macon-Bibb County, GA",Central,218,1363000,1
2020-04-14,Wrdv Inc,Chapter,561311,Administrative and Support and Waste Management and Remediation Services,Administrative and Support Services,Employment Placement Agencies ,U,U,U,N,3108 Mercer University Dr,Macon,31201.0,13021,Bibb County,31420,"Macon-Bibb County, GA",Central,368,1362425,1
2020-04-15,"Primary Pediatrics, Pc",Corp,621111,Health Care and Social Assistance,Ambulatory Health Care Services,Offices of Physicians (except Mental Health Specialists) ,White,Male Owned,Non-Veteran,N,5300 Bowman Park,Macon,31201.0,13021,Bibb County,31420,"Macon-Bibb County, GA",Central,259,1307000,1
2020-04-08,"The Methodist Home Of The South Georgia Conference, Inc.",Non-Profit,813110,Other Services (except Public Administration),"Religious, Grantmaking, Civic, Professional, and Similar Organizations",Religious Organizations ,U,Male Owned,U,Y,304 Pierce Ave,Macon,31201.0,13021,Bibb County,31420,"Macon-Bibb County, GA",Central,202,1295100,1
2020-04-10,"First Presbyterian Day School, Inc.",Corp,611110,Educational Services,Educational Services,Elementary and Secondary Schools ,U,U,U,N,5671 Calvin Drive,Macon,31201.0,13021,Bibb County,31420,"Macon-Bibb County, GA",Central,140,1279912,1
2020-04-14,White Bros Auto Supply Inc,Corp,423120,Wholesale Trade,"Merchant Wholesalers, Durable Goods",Motor Vehicle Supplies and New Parts Merchant Wholesalers ,U,Male Owned,Non-Veteran,N,356 Walnut St,Macon,31201.0,13021,Bibb County,31420,"Macon-Bibb County, GA",Central,30,1271500,1
2020-04-10,Walthall Oil Company,Corp,424710,Wholesale Trade,"Merchant Wholesalers, Nondurable Goods",Petroleum Bulk Stations and Terminals ,White,Male Owned,Non-Veteran,N,2510 Allen Rd,Macon,31201.0,13021,Bibb County,31420,"Macon-Bibb County, GA",Central,124,1270500,1
2020-04-06,The Georgia Neurosurgical Institute Pc,Corp,621111,Health Care and Social Assistance,Ambulatory Health Care Services,Offices of Physicians (except Mental Health Specialists) ,U,U,U,N,840 Pine St Ste 880,Macon,31201.0,13021,Bibb County,31420,"Macon-Bibb County, GA",Central,66,1186700,1
2020-04-14,"Good Vocations, Inc.",Non-Profit,561720,Administrative and Support and Waste Management and Remediation Services,Administrative and Support Services,Janitorial Services ,U,U,U,Y,5171 Eisenhower Parkway,Macon,31201.0,13021,Bibb County,31420,"Macon-Bibb County, GA",Central,201,1154000,1
2020-04-15,"L.E. Schwartz And Son, Inc.",Corp,238160,Construction,Specialty Trade Contractors,Roofing Contractors ,U,Male Owned,Non-Veteran,N,279 Reid St,Macon,31201.0,13021,Bibb County,31420,"Macon-Bibb County, GA",Central,83,1105641,1
2020-04-27,"Jackson Automotive Group, Inc.",Chapter,441110,Retail Trade,Motor Vehicle and Parts Dealers,New Car Dealers ,U,U,U,N,4781 Riverside Dr,Macon,31201.0,13021,Bibb County,31420,"Macon-Bibb County, GA",Central,0,1104500,1
2020-04-08,"Central Georgia Cancer Care, Pc",Corp,621111,Health Care and Social Assistance,Ambulatory Health Care Services,Offices of Physicians (except Mental Health Specialists) ,U,U,U,N,800 First Street,Macon,31201.0,13021,Bibb County,31420,"Macon-Bibb County, GA",Central,102,1060225,1
2020-06-18,Propel Opportunity Fund Inc.,Corp,531110,Real Estate and Rental and Leasing,Real Estate,Lessors of Residential Buildings and Dwellings ,U,U,U,N,830 Mulberry Street,Macon,31201.0,13021,Bibb County,31420,"Macon-Bibb County, GA",Central,18,1051395,1
2020-04-08,All-State Electrical Contractors Llc,LLC,238210,Construction,Specialty Trade Contractors,Electrical Contractors and Other Wiring Installation Contractors,White,Male Owned,Non-Veteran,N,4390 Interstate Dr,Macon,31201.0,13021,Bibb County,31420,"Macon-Bibb County, GA",Central,87,1039000,1
2020-04-08,"Mid-Georgia Electrical Service, Inc.",Corp,238210,Construction,Specialty Trade Contractors,Electrical Contractors and Other Wiring Installation Contractors,White,Male Owned,Non-Veteran,N,594 Industrial Way,Macon,31201.0,13021,Bibb County,31420,"Macon-Bibb County, GA",Central,55,1038000,1
2020-04-27,Trustees Of Mount De Sales Academy,Prof. Assoc.,611110,Educational Services,Educational Services,Elementary and Secondary Schools ,U,U,U,N,851 Orange Street,Macon,31201.0,13021,Bibb County,31420,"Macon-Bibb County, GA",Central,84,1037800,1
2020-04-09,"Internal Medicine Associates, Pc",Corp,621111,Health Care and Social Assistance,Ambulatory Health Care Services,Offices of Physicians (except Mental Health Specialists) ,U,U,U,N,"330 Hospital Drive, Bldg C, Suite 200",Macon,31201.0,13021,Bibb County,31420,"Macon-Bibb County, GA",Central,78,1000900,1
2020-04-11,"Piedmont Construction Group I, Llc",LLC,236220,Construction,Construction of Buildings,Commercial and Institutional Building Construction ,White,Male Owned,Non-Veteran,N,107 B Gateway Dr,Macon,31201.0,13021,Bibb County,31420,"Macon-Bibb County, GA",Central,52,999000,1
2020-04-30,Cogent Healthcare Of Macon Llc,LLC,621111,Health Care and Social Assistance,Ambulatory Health Care Services,Offices of Physicians (except Mental Health Specialists) ,U,U,U,N,6501 Peake Rd Suite 700,Macon,31201.0,13021,Bibb County,31420,"Macon-Bibb County, GA",Central,46,973000,1
2020-04-08,Pyles Plumbing And Utility Contractors Inc,Corp,238220,Construction,Specialty Trade Contractors,"Plumbing, Heating, and Air-Conditioning Contractors ",White,Male Owned,Non-Veteran,N,835 Hillcrest Industrial Blvd,Macon,31201.0,13021,Bibb County,31420,"Macon-Bibb County, GA",Central,87,950000,1
2020-04-05,"First Choice Primary Care, Inc.",Corp,813211,Other Services (except Public Administration),"Religious, Grantmaking, Civic, Professional, and Similar Organizations",Grantmaking Foundations ,White,Male Owned,U,N,770 Walnut Street,Macon,31201.0,13021,Bibb County,31420,"Macon-Bibb County, GA",Central,86,943200,1
2020-05-01,Southern Trust Insurance Company,Corp,524210,Finance and Insurance,Insurance Carriers and Related Activities,Insurance Agencies and Brokerages ,U,U,U,N,5444 Riverside Drive,Macon,31201.0,13021,Bibb County,31420,"Macon-Bibb County, GA",Central,61,930348,1
2020-04-14,Bibb Distributing Co,Corp,424810,Wholesale Trade,"Merchant Wholesalers, Nondurable Goods",Beer and Ale Merchant Wholesalers ,U,U,U,N,6401 Hawkinsville Rd,Macon,31201.0,13021,Bibb County,31420,"Macon-Bibb County, GA",Central,74,929340,1
2020-04-05,The Ent Center Of Central Georgia P.C.,Corp,621210,Health Care and Social Assistance,Ambulatory Health Care Services,Offices of Dentists ,White,Male Owned,Non-Veteran,N,540 Hemlock St,Macon,31201.0,13021,Bibb County,31420,"Macon-Bibb County, GA",Central,0,920500,1
2020-04-28,Chris R. Sheridan & Co. Dba Sheridan Construction,Chapter,236210,Construction,Construction of Buildings,Industrial Building Construction ,U,Male Owned,Non-Veteran,N,1572 Schofield Street,Macon,31201.0,13021,Bibb County,31420,"Macon-Bibb County, GA",Central,55,893855,1
2020-04-27,"Elliott Machine Shop, Inc.",Chapter,423840,Wholesale Trade,"Merchant Wholesalers, Durable Goods",Industrial Supplies Merchant Wholesalers,U,Male Owned,U,N,5495 Level Acres Dr,Macon,31201.0,13021,Bibb County,31420,"Macon-Bibb County, GA",Central,10,880000,1
2020-04-10,"Unique Auto Sales, Llc",Chapter,441120,Retail Trade,Motor Vehicle and Parts Dealers,Used Car Dealers ,U,U,U,N,8083 Rivoli Rd,Bolingbroke,31210.0,13207,Monroe County,31420,"Macon-Bibb County, GA",Central,58,874622,1
2020-04-15,Courageous Home Healthcare Inc,Sole Oroprietor,621399,Health Care and Social Assistance,Ambulatory Health Care Services,Offices of All Other Miscellaneous Health Practitioners ,U,Male Owned,Non-Veteran,N,1667 Eisenhower Parkway,Macon,31201.0,13021,Bibb County,31420,"Macon-Bibb County, GA",Central,300,850000,1
2020-04-10,"Thomson Global Holdings, Inc",Chapter,551112,Management of Companies and Enterprises,Management of Companies and Enterprises,Offices of Other Holding Companies ,U,Male Owned,Non-Veteran,N,7800 Ne Industrial Blvd,Macon,31201.0,13021,Bibb County,31420,"Macon-Bibb County, GA",Central,55,848470,1
2020-04-15,Grogreen Solutions Georgia Llc,LLC,561790,Administrative and Support and Waste Management and Remediation Services,Administrative and Support Services,Other Services to Buildings and Dwellings ,U,U,U,N,105 Camellia Plant Drive,Juliette,31046.0,13207,Monroe County,31420,"Macon-Bibb County, GA",Central,74,835000,1
2020-04-06,"Skin Care Physicians Of Georgia, Pc",Corp,621111,Health Care and Social Assistance,Ambulatory Health Care Services,Offices of Physicians (except Mental Health Specialists) ,U,U,U,N,308 Coliseum Dr Suite 200,Macon,31201.0,13021,Bibb County,31420,"Macon-Bibb County, GA",Central,72,829500,1
2020-04-14,"Panaprint, Inc.",Corp,323111,Manufacturing,Printing and Related Support Activities,Commercial Printing (except Screen and Books) ,U,U,U,N,7979 Ne Industrial Blvd,Macon,31201.0,13021,Bibb County,31420,"Macon-Bibb County, GA",Central,79,816547,1
2020-04-28,"Walsh Quality Imports, Inc.",Chapter,441110,Retail Trade,Motor Vehicle and Parts Dealers,New Car Dealers ,White,Male Owned,Non-Veteran,N,2056 Eisenhower Pkwy,Macon,31201.0,13021,Bibb County,31420,"Macon-Bibb County, GA",Central,80,791500,1
2020-04-06,Prince Precision Products Llc,LLC,332999,Manufacturing,Fabricated Metal Product Manufacturing,All Other Miscellaneous Fabricated Metal Product Manufacturing ,White,Male Owned,Non-Veteran,N,6600 Hawkinsville Rd,Macon,31201.0,13021,Bibb County,31420,"Macon-Bibb County, GA",Central,68,745000,1
2020-04-12,"Hodges, Harbin, Newberry & Tribble, Inc",Chapter,541330,"Professional, Scientific, and Technical Services","Professional, Scientific, and Technical Services",Engineering Services,U,U,U,N,3920 Arkwright Rd,Macon,31201.0,13021,Bibb County,31420,"Macon-Bibb County, GA",Central,40,737500,1
2020-04-29,Hamlin Air Conditioning & Sheet Metal Inc,Corp,238220,Construction,Specialty Trade Contractors,"Plumbing, Heating, and Air-Conditioning Contractors ",U,U,U,N,4023 475 Industrial Blvd,Macon,31201.0,13021,Bibb County,31420,"Macon-Bibb County, GA",Central,65,733522,1
2020-04-10,Ingleside Baptist Church Inc.,Non-Profit,813110,Other Services (except Public Administration),"Religious, Grantmaking, Civic, Professional, and Similar Organizations",Religious Organizations ,U,U,U,Y,834 Wimbish Rd,Macon,31201.0,13021,Bibb County,31420,"Macon-Bibb County, GA",Central,92,732045,1
2020-04-15,Girl Scouts Of Historic Georgia Inc,Non-Profit,813410,Other Services (except Public Administration),"Religious, Grantmaking, Civic, Professional, and Similar Organizations",Civic and Social Organizations ,U,U,U,Y,6869 Columbus Rd,Lizella,31052.0,13021,Bibb County,31420,"Macon-Bibb County, GA",Central,70,730600,1
2020-04-15,"Gastroenterology Associates Of Central Georgia, Llc",LLC,621111,Health Care and Social Assistance,Ambulatory Health Care Services,Offices of Physicians (except Mental Health Specialists) ,U,U,U,N,610  3Rd St,Macon,31201.0,13021,Bibb County,31420,"Macon-Bibb County, GA",Central,56,730500,1
2020-04-15,Carter & Sloope Inc,Chapter,541310,"Professional, Scientific, and Technical Services","Professional, Scientific, and Technical Services",Architectural Services,U,U,U,N,6310 Peake Rd,Macon,31201.0,13021,Bibb County,31420,"Macon-Bibb County, GA",Central,48,728000,1
2020-04-12,"Midstate Steel, Inc.",Corp,236115,Construction,Construction of Buildings,New Single-Family Housing Construction (except For-Sale Builders) ,U,Male Owned,Non-Veteran,N,2001 Jeffersonville Rd,Macon,31201.0,13021,Bibb County,31420,"Macon-Bibb County, GA",Central,50,700500,1
2020-05-04,"Raffield Tire Masters, Inc.",Corp,441320,Retail Trade,Motor Vehicle and Parts Dealers,Tire Dealers ,U,Female Owned,Non-Veteran,N,3312 Northside Dr  Suite D100,Macon,31201.0,13021,Bibb County,31420,"Macon-Bibb County, GA",Central,0,685000,1
2020-04-09,Atlanta Sand & Supply Company,Chapter,212321,"Mining, Quarrying, and Oil and Gas Extraction",Mining (except Oil and Gas),Construction Sand and Gravel Mining ,U,U,U,N,6501 Peake Rd,Macon,31201.0,13021,Bibb County,31420,"Macon-Bibb County, GA",Central,52,676300,1
2020-04-28,"Sutton Chapman Automotive, Llc",LLC,441110,Retail Trade,Motor Vehicle and Parts Dealers,New Car Dealers ,U,Male Owned,Non-Veteran,N,4796 Riverside Dr,Macon,31201.0,13021,Bibb County,31420,"Macon-Bibb County, GA",Central,45,670154,1
2020-04-10,J J Butler Inc,Corp,441110,Retail Trade,Motor Vehicle and Parts Dealers,New Car Dealers ,U,U,U,N,4550 Riverside Dr,Macon,31201.0,13021,Bibb County,31420,"Macon-Bibb County, GA",Central,44,668977,1
2020-04-05,"Lcof Macon Operating, Llc",LLC,999990,,,,U,U,U,N,240 Coiiseum Drive,Macon,31201.0,13021,Bibb County,31420,"Macon-Bibb County, GA",Central,0,668062,1
2020-04-11,Magic Wheel & Tire Llc Dba Rimtyme,LLC,441320,Retail Trade,Motor Vehicle and Parts Dealers,Tire Dealers ,White,Male Owned,Non-Veteran,N,3695 Vineville Ave,Macon,31201.0,13021,Bibb County,31420,"Macon-Bibb County, GA",Central,64,660510,1
2020-04-14,"Tattnall Square Academy, Inc.",Non-Profit,611110,Educational Services,Educational Services,Elementary and Secondary Schools ,U,U,U,Y,111 Trojan Trail,Macon,31201.0,13021,Bibb County,31420,"Macon-Bibb County, GA",Central,90,655300,1
2020-05-09,Austin Smith Center For Community Development Inc,Corp,812990,Other Services (except Public Administration),Personal and Laundry Services,All Other Personal Services ,U,U,U,N,5464 Bethesda Avenue,Macon,31201.0,13021,Bibb County,31420,"Macon-Bibb County, GA",Central,15,654315,1
2020-04-15,"Hospital Authority Of Monroe County, Ga",Prof. Assoc.,622110,Health Care and Social Assistance,Hospitals,General Medical and Surgical Hospitals ,U,U,U,N,88 Martin Luther King Jr Drive,Forsyth,31029.0,13207,Monroe County,31420,"Macon-Bibb County, GA",Central,100,648678,1
2020-04-07,Jmls Enterprises Llc,LLC,621210,Health Care and Social Assistance,Ambulatory Health Care Services,Offices of Dentists ,White,Male Owned,Non-Veteran,N,225 North Macon Street,Macon,31201.0,13021,Bibb County,31420,"Macon-Bibb County, GA",Central,40,643421,1
2020-04-29,Bdm&M,LLC,441110,Retail Trade,Motor Vehicle and Parts Dealers,New Car Dealers ,U,U,U,N,4785 Riverside Dr,Macon,31201.0,13021,Bibb County,31420,"Macon-Bibb County, GA",Central,42,641400,1
2020-04-07,"Thomas C. Jones, M.D., P.C.",Corp,621399,Health Care and Social Assistance,Ambulatory Health Care Services,Offices of All Other Miscellaneous Health Practitioners ,White,Male Owned,Veteran,N,265 Sheraton Blvd,Macon,31201.0,13021,Bibb County,31420,"Macon-Bibb County, GA",Central,16,638500,1
2020-04-27,Trippduke Inc.,Corp,722513,Accommodation and Food Services,Food Services and Drinking Places,Limited-Service Restaurants ,U,U,U,N,3872 The Prado,Macon,31201.0,13021,Bibb County,31420,"Macon-Bibb County, GA",Central,0,632976,1
2020-04-15,"Middle Georgia Truck Repair, Inc.",Chapter,441228,Retail Trade,Motor Vehicle and Parts Dealers,"Motorcycle, ATV, and All Other Motor Vehicle Dealers ",White,Male Owned,Veteran,N,6391 Hawkinsville Rd,Macon,31201.0,13021,Bibb County,31420,"Macon-Bibb County, GA",Central,57,627500,1
2020-04-09,B And B Free Llc,LLC,722513,Accommodation and Food Services,Food Services and Drinking Places,Limited-Service Restaurants ,U,Male Owned,U,N,Po Box 27030,Macon,31201.0,13021,Bibb County,31420,"Macon-Bibb County, GA",Central,178,618770,1
2020-04-27,"Vineville Internal Medicine, Llc",LLC,621111,Health Care and Social Assistance,Ambulatory Health Care Services,Offices of Physicians (except Mental Health Specialists) ,U,U,U,N,3448 Vineville Ave.,Macon,31201.0,13021,Bibb County,31420,"Macon-Bibb County, GA",Central,50,615200,1
2020-04-07,Bryant Refrigeration And Air Conditioning Inc.,Corp,238220,Construction,Specialty Trade Contractors,"Plumbing, Heating, and Air-Conditioning Contractors ",U,U,U,N,792 Martin Luther King Jr Blvd,Macon,31201.0,13021,Bibb County,31420,"Macon-Bibb County, GA",Central,53,603000,1
2020-04-07,W Carl Reynolds P C,Corp,541110,"Professional, Scientific, and Technical Services","Professional, Scientific, and Technical Services",Offices of Lawyers,U,U,U,N,6320 Peake Rd,Macon,31201.0,13021,Bibb County,31420,"Macon-Bibb County, GA",Central,37,590500,1
2020-05-18,"Allied Business Systems, Llc",LLC,541511,"Professional, Scientific, and Technical Services","Professional, Scientific, and Technical Services",Custom Computer Programming Services ,U,U,U,N,4848 Mercer University Drive,Macon,31201.0,13021,Bibb County,31420,"Macon-Bibb County, GA",Central,37,588552,1
2020-04-11,"Bag Macon Chev, Llc",LLC,441110,Retail Trade,Motor Vehicle and Parts Dealers,New Car Dealers ,U,U,U,N,2020 Riverside Dr,Macon,31201.0,13021,Bibb County,31420,"Macon-Bibb County, GA",Central,29,583300,1
2020-04-14,Hutchinson Automotive Inc,Chapter,441110,Retail Trade,Motor Vehicle and Parts Dealers,New Car Dealers ,U,U,U,N,3989 River Place Dr,Macon,31201.0,13021,Bibb County,31420,"Macon-Bibb County, GA",Central,55,579450,1
2020-04-08,All Care Home Health Llc,LLC,621610,Health Care and Social Assistance,Ambulatory Health Care Services,Home Health Care Services,White,Male Owned,Veteran,N,5797 Houston Rd Ste F,Macon,31201.0,13021,Bibb County,31420,"Macon-Bibb County, GA",Central,113,576372,1
2020-04-07,Macon Occupational Medicine Llc,LLC,621111,Health Care and Social Assistance,Ambulatory Health Care Services,Offices of Physicians (except Mental Health Specialists) ,U,Male Owned,U,N,124 3Rd St,Macon,31201.0,13021,Bibb County,31420,"Macon-Bibb County, GA",Central,42,573000,1
2020-04-06,"Conditioned Air, Inc.",Corp,238220,Construction,Specialty Trade Contractors,"Plumbing, Heating, and Air-Conditioning Contractors ",White,Male Owned,Non-Veteran,N,241 South Street,Macon,31201.0,13021,Bibb County,31420,"Macon-Bibb County, GA",Central,8,572500,1
2020-04-08,Moonhanger Group Llc,LLC,722511,Accommodation and Food Services,Food Services and Drinking Places,Full-Service Restaurants ,White,Male Owned,Non-Veteran,N,543 Cherry St,Macon,31201.0,13021,Bibb County,31420,"Macon-Bibb County, GA",Central,113,571500,1
2020-04-14,"Progressive Healthcare Solutions, Llc",LLC,541519,"Professional, Scientific, and Technical Services","Professional, Scientific, and Technical Services",Other Computer Related Services,White,Male Owned,U,N,300 Mulberry St,Macon,31201.0,13021,Bibb County,31420,"Macon-Bibb County, GA",Central,88,571300,1
2020-04-10,"Prince Sheet Metal Works, Inc",Corp,238110,Construction,Specialty Trade Contractors,Poured Concrete Foundation and Structure Contractors ,White,Male Owned,Non-Veteran,N,7539 Hawkinsville Road,Macon,31201.0,13021,Bibb County,31420,"Macon-Bibb County, GA",Central,46,569500,1
2020-04-10,"Fickling Management Services, Llc",LLC,531210,Real Estate and Rental and Leasing,Real Estate,Offices of Real Estate Agents and Brokers,U,U,U,N,577 Mulberry St,Macon,31201.0,13021,Bibb County,31420,"Macon-Bibb County, GA",Central,55,567361,1
