Date,Recipient,BusinessType,NAICS,Industry-2,Industry-3,Industry,RaceEthnicity,Gender,Veteran,NonProfit,Address,City,ZCTA,FIPS,County,CBSA,MSA,CDRegion,Jobs,Amount,Loans
2020-04-08,"H.A. Sack Co., Inc.",Corp,238120,Construction,Specialty Trade Contractors,Structural Steel and Precast Concrete Contractors ,U,U,U,N,3302 Zell Miller Pkwy,Statesboro,30458.0,13031,Bulloch County,44340,"Statesboro, GA",Coastal,257,3720295,1
2020-04-30,Pineland Area Community Service Board,Corp,621420,Health Care and Social Assistance,Ambulatory Health Care Services,Outpatient Mental Health and Substance Abuse Centers ,White,Female Owned,U,N,5  West Altman Street,Statesboro,30458.0,13031,Bulloch County,44340,"Statesboro, GA",Coastal,488,2441800,1
2020-04-08,"Claude Howard Lumber Company, Inc",Chapter,423310,Wholesale Trade,"Merchant Wholesalers, Durable Goods","Lumber, Plywood, Millwork, and Wood Panel Merchant Wholesalers ",White,Male Owned,U,N,600 Park Ave,Statesboro,30458.0,13031,Bulloch County,44340,"Statesboro, GA",Coastal,109,1531539,1
2020-04-11,Georgia Living Management Inc,Corp,623110,Health Care and Social Assistance,Nursing and Residential Care Facilities,Nursing Care Facilities (Skilled Nursing Facilities) ,U,Male Owned,Veteran,N,203 Donehoo St,Statesboro,30458.0,13031,Bulloch County,44340,"Statesboro, GA",Coastal,236,1162192,1
2020-04-09,Brodie Meter Co Llc,LLC,334514,Manufacturing,Computer and Electronic Product Manufacturing,Totalizing Fluid Meter and Counting Device Manufacturing ,U,U,U,N,19267 Highway 301 North,Statesboro,30458.0,13031,Bulloch County,44340,"Statesboro, GA",Coastal,72,1060854,1
2020-04-15,Georgia Living At Home Llc,LLC,621399,Health Care and Social Assistance,Ambulatory Health Care Services,Offices of All Other Miscellaneous Health Practitioners ,U,Male Owned,Veteran,N,203 Donehoo St,Statesboro,30458.0,13031,Bulloch County,44340,"Statesboro, GA",Coastal,296,1049060,1
2020-04-09,"Savannah Service & Food (Yum), Llc",LLC,722513,Accommodation and Food Services,Food Services and Drinking Places,Limited-Service Restaurants ,U,U,U,N,7 North Main Street,Statesboro,30458.0,13031,Bulloch County,44340,"Statesboro, GA",Coastal,218,950850,1
2020-04-10,"A.M. Braswell, Jr. Food Company",Corp,311421,Manufacturing,Food Manufacturing,Fruit and Vegetable Canning ,U,U,U,N,226 Zetterower Ave,Statesboro,30458.0,13031,Bulloch County,44340,"Statesboro, GA",Coastal,87,894735,1
2020-04-11,"Franklin Chevrolet Co., Inc.",Corp,441110,Retail Trade,Motor Vehicle and Parts Dealers,New Car Dealers ,U,U,U,N,106 Northside Drive E,Statesboro,30458.0,13031,Bulloch County,44340,"Statesboro, GA",Coastal,0,885640,1
2020-04-09,"Southeast Roofing Solutions, Inc.",Corp,238160,Construction,Specialty Trade Contractors,Roofing Contractors ,U,U,U,N,16101 Hwy 80 W,Statesboro,30458.0,13031,Bulloch County,44340,"Statesboro, GA",Coastal,74,839942,1
2020-04-09,"Kentucky Fried Chicken Of Statesboro, Ga, Inc.",Corp,722513,Accommodation and Food Services,Food Services and Drinking Places,Limited-Service Restaurants ,U,U,U,N,7 North Main Street,Statesboro,30458.0,13031,Bulloch County,44340,"Statesboro, GA",Coastal,186,805972,1
2020-04-15,Howard Lumber & Hardware Inc,Corp,423310,Wholesale Trade,"Merchant Wholesalers, Durable Goods","Lumber, Plywood, Millwork, and Wood Panel Merchant Wholesalers ",White,Male Owned,U,N,600 Gentilly Rd,Statesboro,30458.0,13031,Bulloch County,44340,"Statesboro, GA",Coastal,64,799450,1
2020-04-09,H&H Food Services Llc,LLC,722513,Accommodation and Food Services,Food Services and Drinking Places,Limited-Service Restaurants ,U,U,U,N,7 North Main St,Statesboro,30458.0,13031,Bulloch County,44340,"Statesboro, GA",Coastal,180,758576,1
2020-04-09,"Wm Sheppard Lumber Co, Inc",Corp,321113,Manufacturing,Wood Product Manufacturing,Sawmills ,U,U,U,N,15175 Us Hwy 80 East,Brooklet,30415.0,13031,Bulloch County,44340,"Statesboro, GA",Coastal,80,627850,1
2020-04-12,Ogeechee Area Hospice Inc,Corp,621610,Health Care and Social Assistance,Ambulatory Health Care Services,Home Health Care Services,U,U,U,N,200 Donehoo St,Statesboro,30458.0,13031,Bulloch County,44340,"Statesboro, GA",Coastal,62,598839,1
2020-04-08,"Bulloch Academy, Inc.",Non-Profit,611110,Educational Services,Educational Services,Elementary and Secondary Schools ,U,U,U,Y,873 Westside Rd,Statesboro,30458.0,13031,Bulloch County,44340,"Statesboro, GA",Coastal,70,573668,1
2020-04-09,"Lewis Color Lithographers, Inc.",Corp,323111,Manufacturing,Printing and Related Support Activities,Commercial Printing (except Screen and Books) ,U,U,U,N,30 Joe Kennedy Blvd,Statesboro,30458.0,13031,Bulloch County,44340,"Statesboro, GA",Coastal,47,571193,1
2020-04-11,"Franklin'S Budget Car Sales, Inc.",Chapter,441110,Retail Trade,Motor Vehicle and Parts Dealers,New Car Dealers ,U,U,U,N,500 Commerce Dr,Statesboro,30458.0,13031,Bulloch County,44340,"Statesboro, GA",Coastal,0,488942,1
2020-04-15,Steve H Powell & Company Inc,Corp,541618,"Professional, Scientific, and Technical Services","Professional, Scientific, and Technical Services",Other Management Consulting Services ,U,U,U,N,23 Courtland St,Statesboro,30458.0,13031,Bulloch County,44340,"Statesboro, GA",Coastal,24,485423,1
2020-04-08,James L Oates Iii Enterprises Inc,Corp,238220,Construction,Specialty Trade Contractors,"Plumbing, Heating, and Air-Conditioning Contractors ",U,Male Owned,Non-Veteran,N,1378 Ga Hwy 46,Register,30452.0,13031,Bulloch County,44340,"Statesboro, GA",Coastal,44,460077,1
2020-04-10,Tq Constructors Inc,Corp,423390,Wholesale Trade,"Merchant Wholesalers, Durable Goods",Other Construction Material Merchant Wholesalers ,U,U,U,N,349 Jimps Rd,Statesboro,30458.0,13031,Bulloch County,44340,"Statesboro, GA",Coastal,29,451077,1
2020-04-13,"Allgreen Services, Llc",LLC,562111,Administrative and Support and Waste Management and Remediation Services,Waste Management and Remediation Services,Solid Waste Collection ,U,U,U,N,4795 Us Highway 301 S,Register,30452.0,13031,Bulloch County,44340,"Statesboro, GA",Coastal,44,430000,1
2020-04-10,"Bulloch Fertilizer Co., Inc.",Corp,424910,Wholesale Trade,"Merchant Wholesalers, Nondurable Goods",Farm Supplies Merchant Wholesalers ,White,Male Owned,U,N,205 West Main St,Statesboro,30458.0,13031,Bulloch County,44340,"Statesboro, GA",Coastal,46,414615,1
2020-04-09,The Hodges Management Company,Corp,561110,Administrative and Support and Waste Management and Remediation Services,Administrative and Support Services,Office Administrative Services,U,U,U,N,7 North Main Street,Statesboro,30458.0,13031,Bulloch County,44340,"Statesboro, GA",Coastal,17,400323,1
2020-04-27,Y-Delta Inc.,Chapter,238220,Construction,Specialty Trade Contractors,"Plumbing, Heating, and Air-Conditioning Contractors ",U,U,U,N,5657 Lakeview Rd,Statesboro,30458.0,13031,Bulloch County,44340,"Statesboro, GA",Coastal,45,396739,1
2020-04-10,Maxwell-Reddick & Associates Inc,Chapter,541330,"Professional, Scientific, and Technical Services","Professional, Scientific, and Technical Services",Engineering Services,U,U,U,N,40 Joe Kennedy Blvd,Statesboro,30458.0,13031,Bulloch County,44340,"Statesboro, GA",Coastal,33,395503,1
2020-04-09,Savannah Service & Food Llc,LLC,722513,Accommodation and Food Services,Food Services and Drinking Places,Limited-Service Restaurants ,U,U,U,N,7 N Main St,Statesboro,30458.0,13031,Bulloch County,44340,"Statesboro, GA",Coastal,90,388531,1
2020-04-15,Britt Parrish Statesboro Llc,LLC,423110,Wholesale Trade,"Merchant Wholesalers, Durable Goods",Automobile and Other Motor Vehicle Merchant Wholesalers ,U,U,U,N,12114 Us Highway 301 S,Statesboro,30458.0,13031,Bulloch County,44340,"Statesboro, GA",Coastal,32,367118,1
2020-04-14,"Pope Construction Company, Inc.",Chapter,236220,Construction,Construction of Buildings,Commercial and Institutional Building Construction ,White,Male Owned,U,N,3006 Northside Dr West,Statesboro,30458.0,13031,Bulloch County,44340,"Statesboro, GA",Coastal,32,366574,1
2020-04-10,Walker Pharmacy & Gifts Inc,Corp,446110,Retail Trade,Health and Personal Care Stores,Pharmacies and Drug Stores ,U,U,U,N,2425 Northside Dr W,Statesboro,30458.0,13031,Bulloch County,44340,"Statesboro, GA",Coastal,55,359100,1
2020-04-09,Statesboro Cardiology Pa,Chapter,621111,Health Care and Social Assistance,Ambulatory Health Care Services,Offices of Physicians (except Mental Health Specialists) ,U,U,U,N,5 Grady Johnson Rd,Statesboro,30458.0,13031,Bulloch County,44340,"Statesboro, GA",Coastal,33,357964,1
2020-04-11,"Sumner Brothers, L.L.C.",LLC,447110,Retail Trade,Gasoline Stations,Gasoline Stations with Convenience Stores ,U,U,U,N,2021 Plantation Pointe Dr,Statesboro,30458.0,13031,Bulloch County,44340,"Statesboro, GA",Coastal,65,329957,1
2020-04-08,Marsh Construction Services Llc,LLC,236220,Construction,Construction of Buildings,Commercial and Institutional Building Construction ,U,U,U,N,201 Pretoria Rushin Road,Statesboro,30458.0,13031,Bulloch County,44340,"Statesboro, GA",Coastal,0,317632,1
2020-04-08,"Preferred Site Construction, Llc",LLC,237310,Construction,Heavy and Civil Engineering Construction,"Highway, Street, and Bridge Construction ",U,U,U,N,9521 Us Highway 301 S,Statesboro,30458.0,13031,Bulloch County,44340,"Statesboro, GA",Coastal,0,316204,1
2020-04-15,Westwood Pac Llc,LLC,623110,Health Care and Social Assistance,Nursing and Residential Care Facilities,Nursing Care Facilities (Skilled Nursing Facilities) ,U,U,U,N,101 Stockyard Rd,Statesboro,30458.0,13031,Bulloch County,44340,"Statesboro, GA",Coastal,62,314400,1
2020-04-10,"Taulbee,Rushing,Snipes, Marsh & Hodgin, Llc",LLC,541110,"Professional, Scientific, and Technical Services","Professional, Scientific, and Technical Services",Offices of Lawyers,U,U,U,N,12 Siebald St,Statesboro,30458.0,13031,Bulloch County,44340,"Statesboro, GA",Coastal,36,311509,1
2020-04-06,"Ellis Wood Contracting, Inc.",Corp,324121,Manufacturing,Petroleum and Coal Products Manufacturing,Asphalt Paving Mixture and Block Manufacturing ,U,U,U,N,9326 Hwy 301 South,Statesboro,30458.0,13031,Bulloch County,44340,"Statesboro, GA",Coastal,28,310700,1
2020-04-11,"Vaden Of Statesboro, Inc.",Chapter,441110,Retail Trade,Motor Vehicle and Parts Dealers,New Car Dealers ,U,U,U,N,686 Brannen St,Statesboro,30458.0,13031,Bulloch County,44340,"Statesboro, GA",Coastal,0,303704,1
2020-04-13,"Ranco Tent Rental, Inc.",Corp,532310,Real Estate and Rental and Leasing,Rental and Leasing Services,General Rental Centers,White,Male Owned,Veteran,N,73 South College St,Statesboro,30458.0,13031,Bulloch County,44340,"Statesboro, GA",Coastal,50,287810,1
2020-04-09,Charter Conservatory For Liberal Arts & Technology,Non-Profit,611110,Educational Services,Educational Services,Elementary and Secondary Schools ,U,U,U,Y,1718 Northside Dr,Statesboro,30458.0,13031,Bulloch County,44340,"Statesboro, GA",Coastal,29,283087,1
2020-04-10,"Dabbs, Hickman, Hill & Cannon, Llp",LLP,541211,"Professional, Scientific, and Technical Services","Professional, Scientific, and Technical Services",Offices of Certified Public Accountants ,U,U,U,N,319 South Main Street,Statesboro,30458.0,13031,Bulloch County,44340,"Statesboro, GA",Coastal,21,282800,1
2020-04-09,"Southern Family Medicine Of Georgia, Llc",LLC,621111,Health Care and Social Assistance,Ambulatory Health Care Services,Offices of Physicians (except Mental Health Specialists) ,U,U,U,N,1140 Brampton Ave,Statesboro,30458.0,13031,Bulloch County,44340,"Statesboro, GA",Coastal,43,277781,1
2020-04-15,"Ken'S Supermarket, Inc.",Corp,445110,Retail Trade,Food and Beverage Stores,Supermarkets and Other Grocery (except Convenience) Stores ,U,U,U,N,17518 Us Highway 80 East,Brooklet,30415.0,13031,Bulloch County,44340,"Statesboro, GA",Coastal,87,276943,1
2020-04-15,Statesboro Erectors Inc,Corp,236117,Construction,Construction of Buildings,New Housing For-Sale Builders ,White,Male Owned,Non-Veteran,N,622 Pear Orchard Rd,Statesboro,30458.0,13031,Bulloch County,44340,"Statesboro, GA",Coastal,15,272809,1
2020-04-10,Digital Office Equipment Company Inc,Chapter,423420,Wholesale Trade,"Merchant Wholesalers, Durable Goods",Office Equipment Merchant Wholesalers ,U,Female Owned,U,N,10929 Us Highway 301 Ste 5,Statesboro,30458.0,13031,Bulloch County,44340,"Statesboro, GA",Coastal,34,266459,1
2020-04-08,Gnat'S Landing Of Statesboro Llc,LLC,722511,Accommodation and Food Services,Food Services and Drinking Places,Full-Service Restaurants ,U,Male Owned,Veteran,N,470 S Main St,Statesboro,30458.0,13031,Bulloch County,44340,"Statesboro, GA",Coastal,100,262600,1
2020-04-13,Bulloch Pediatric Group Llc,LLC,621112,Health Care and Social Assistance,Ambulatory Health Care Services,"Offices of Physicians, Mental Health Specialists ",U,U,U,N,1044 Bermuda Run,Statesboro,30458.0,13031,Bulloch County,44340,"Statesboro, GA",Coastal,19,254517,1
2020-04-14,L A Waters Furniture Company Inc,Corp,442110,Retail Trade,Furniture and Home Furnishings Stores,Furniture Stores ,U,U,U,N,8 W Main St,Statesboro,30458.0,13031,Bulloch County,44340,"Statesboro, GA",Coastal,38,248518,1
2020-04-09,Tlt Trucking Llc,LLC,484230,Transportation and Warehousing,Truck Transportation,"Specialized Freight (except Used Goods) Trucking, Long-Distance ",U,Male Owned,Non-Veteran,N,1213 Merchants Way Suite 103,Statesboro,30458.0,13031,Bulloch County,44340,"Statesboro, GA",Coastal,33,248275,1
2020-04-14,Family Health Care Center Inc,Corp,621111,Health Care and Social Assistance,Ambulatory Health Care Services,Offices of Physicians (except Mental Health Specialists) ,U,U,U,N,23702 Us Highway 80 E,Statesboro,30458.0,13031,Bulloch County,44340,"Statesboro, GA",Coastal,25,242710,1
2020-04-15,Kennedy Industries Inc,Corp,444220,Retail Trade,Building Material and Garden Equipment and Supplies Dealers,"Nursery, Garden Center, and Farm Supply Stores ",U,U,U,N,18853 Hwy 80East,Statesboro,30458.0,13031,Bulloch County,44340,"Statesboro, GA",Coastal,23,232700,1
2020-04-11,"Aptus Associates, Llc",LLC,541219,"Professional, Scientific, and Technical Services","Professional, Scientific, and Technical Services",Other Accounting Services ,U,U,U,N,Po Box 1067,Statesboro,30458.0,13031,Bulloch County,44340,"Statesboro, GA",Coastal,27,231500,1
2020-04-14,Benton Metal Depot Inc,Corp,423330,Wholesale Trade,"Merchant Wholesalers, Durable Goods","Roofing, Siding, and Insulation Material Merchant Wholesalers ",U,U,U,N,110 Zetterower Rd,Statesboro,30458.0,13031,Bulloch County,44340,"Statesboro, GA",Coastal,19,228254,1
2020-04-07,"Yolo Foods, Llc",LLC,722511,Accommodation and Food Services,Food Services and Drinking Places,Full-Service Restaurants ,White,U,U,N,52 Aspen Heights Dr,Statesboro,30458.0,13031,Bulloch County,44340,"Statesboro, GA",Coastal,83,226825,1
2020-04-09,"Commodity Transportation Service, Llc",LLC,488490,Transportation and Warehousing,Support Activities for Transportation,Other Support Activities for Road Transportation ,U,Male Owned,Non-Veteran,N,1213 Merchants Way Suite 103,Statesboro,30458.0,13031,Bulloch County,44340,"Statesboro, GA",Coastal,15,226315,1
2020-04-08,"Lrmpro, Llc",LLC,541613,"Professional, Scientific, and Technical Services","Professional, Scientific, and Technical Services",Marketing Consulting Services ,U,U,U,N,Po Box 2629,Statesboro,30458.0,13031,Bulloch County,44340,"Statesboro, GA",Coastal,14,226054,1
2020-04-12,"Color Technologies, Inc",Corp,333514,Manufacturing,Machinery Manufacturing,"Special Die and Tool, Die Set, Jig, and Fixture Manufacturing ",U,U,U,N,102 Railroad St,Brooklet,30415.0,13031,Bulloch County,44340,"Statesboro, GA",Coastal,21,225013,1
2020-05-04,"Gmd Services, Inc.",Corp,722513,Accommodation and Food Services,Food Services and Drinking Places,Limited-Service Restaurants ,U,U,U,N,329 S Walnut St,Statesboro,30458.0,13031,Bulloch County,44340,"Statesboro, GA",Coastal,69,221241,1
2020-04-16,Battlbox Llc,LLC,519130,Information,Other Information Services,Internet Publishing and Broadcasting and Web Search Portals,White,Male Owned,Non-Veteran,N,3425 Old Dill Rd,Portal,30450.0,13031,Bulloch County,44340,"Statesboro, GA",Coastal,25,219475,1
2020-04-27,Dabbs-Williams General Contractors Llc,LLC,236220,Construction,Construction of Buildings,Commercial and Institutional Building Construction ,U,U,U,N,319 South Walnut St,Statesboro,30458.0,13031,Bulloch County,44340,"Statesboro, GA",Coastal,18,214132,1
2020-04-10,"Mccook'S Pharmacy, Inc.",Corp,446110,Retail Trade,Health and Personal Care Stores,Pharmacies and Drug Stores ,U,U,U,N,23630 U S Highway 80 East,Statesboro,30458.0,13031,Bulloch County,44340,"Statesboro, GA",Coastal,22,213200,1
2020-05-26,China Company,Corp,722511,Accommodation and Food Services,Food Services and Drinking Places,Full-Service Restaurants ,White,Male Owned,Non-Veteran,N,109 Harvey Drive,Statesboro,30458.0,13031,Bulloch County,44340,"Statesboro, GA",Coastal,50,212700,1
2020-04-14,Connection Ministries Of Statesboro Inc,Non-Profit,813110,Other Services (except Public Administration),"Religious, Grantmaking, Civic, Professional, and Similar Organizations",Religious Organizations ,U,U,U,Y,1342 Cawana Rd,Statesboro,30458.0,13031,Bulloch County,44340,"Statesboro, GA",Coastal,23,208829,1
2020-04-08,Preferred Collision Center Llc,Chapter,811121,Other Services (except Public Administration),Repair and Maintenance,"Automotive Body, Paint, and Interior Repair and Maintenance ",U,Female Owned,U,N,22204 Hwy 80 E,Statesboro,30458.0,13031,Bulloch County,44340,"Statesboro, GA",Coastal,20,207275,1
2020-04-07,"Bethany Assisted Living, Inc",Prof. Assoc.,623312,Health Care and Social Assistance,Nursing and Residential Care Facilities,Assisted Living Facilities for the Elderly ,White,Female Owned,Non-Veteran,N,77 Bethany Way,Statesboro,30458.0,13031,Bulloch County,44340,"Statesboro, GA",Coastal,70,206200,1
2020-04-14,"Wall Orthodontics, Llc",Corp,621210,Health Care and Social Assistance,Ambulatory Health Care Services,Offices of Dentists ,White,Male Owned,Veteran,N,1512 Brampton Ave,Statesboro,30458.0,13031,Bulloch County,44340,"Statesboro, GA",Coastal,16,204733,1
2020-04-15,"Brannen Millwork Corporation, Inc.",Corp,337212,Manufacturing,Furniture and Related Product Manufacturing,Custom Architectural Woodwork and Millwork Manufacturing ,U,U,U,N,3379 Ga Highway 46,Register,30452.0,13031,Bulloch County,44340,"Statesboro, GA",Coastal,26,204174,1
2020-04-07,"Summertime Enterprises, Inc.",Corp,484110,Transportation and Warehousing,Truck Transportation,"General Freight Trucking, Local ",U,U,U,N,1052 Brannen Lake Rd,Statesboro,30458.0,13031,Bulloch County,44340,"Statesboro, GA",Coastal,20,202175,1
2020-04-11,Farmer Automatic Of America Inc,Corp,115116,"Agriculture, Forestry, Fishing and Hunting",Support Activities for Agriculture and Forestry,Farm Management Services ,U,Male Owned,U,N,9333 Us Highway 301 S,Statesboro,30458.0,13031,Bulloch County,44340,"Statesboro, GA",Coastal,21,200345,1
2020-04-10,John E Lavender & Associates Inc,Corp,236115,Construction,Construction of Buildings,New Single-Family Housing Construction (except For-Sale Builders) ,U,U,U,N,300 Pulaski Rd,Statesboro,30458.0,13031,Bulloch County,44340,"Statesboro, GA",Coastal,18,197483,1
2020-04-14,Edenfield & Cox P.C.,Corp,541110,"Professional, Scientific, and Technical Services","Professional, Scientific, and Technical Services",Offices of Lawyers,U,U,U,N,115 Savannah Ave,Statesboro,30458.0,13031,Bulloch County,44340,"Statesboro, GA",Coastal,20,196162,1
2020-04-06,"Tormenta Fc, Llc",LLC,711211,"Arts, Entertainment, and Recreation","Performing Arts, Spectator Sports, and Related Industries",Sports Teams and Clubs ,White,U,U,N,2704 Old Register Rd,Statesboro,30458.0,13031,Bulloch County,44340,"Statesboro, GA",Coastal,37,194413,1
2020-04-14,El Sombrero Mexican Restaurant #14,Corp,722511,Accommodation and Food Services,Food Services and Drinking Places,Full-Service Restaurants ,Hispanic,Male Owned,Non-Veteran,N,879 Buckhead Dr,Statesboro,30458.0,13031,Bulloch County,44340,"Statesboro, GA",Coastal,52,192400,1
2020-04-15,Pope Group Inc,Corp,236220,Construction,Construction of Buildings,Commercial and Institutional Building Construction ,U,Male Owned,U,N,3006 Northside Dr West,Statesboro,30458.0,13031,Bulloch County,44340,"Statesboro, GA",Coastal,12,190412,1
2020-04-06,Statesboro Floor Covering Service Inc,Corp,238330,Construction,Specialty Trade Contractors,Flooring Contractors,U,U,U,N,1123 Northside Dr E,Statesboro,30458.0,13031,Bulloch County,44340,"Statesboro, GA",Coastal,17,188100,1
2020-04-10,Larry G Hubbard Dds Pc,Corp,621210,Health Care and Social Assistance,Ambulatory Health Care Services,Offices of Dentists ,U,U,U,N,4 Lester Rd,Statesboro,30458.0,13031,Bulloch County,44340,"Statesboro, GA",Coastal,0,186839,1
2020-04-06,"Forest Heights Pharmacy, Inc.",Chapter,446110,Retail Trade,Health and Personal Care Stores,Pharmacies and Drug Stores ,U,U,U,N,4439 Country Club Road,Statesboro,30458.0,13031,Bulloch County,44340,"Statesboro, GA",Coastal,28,184100,1
2020-04-05,"Signature Ambulance Of Statesboro, Llc",Corp,621910,Health Care and Social Assistance,Ambulatory Health Care Services,Ambulance Services ,U,U,U,N,9 Allen Cail Dr,Statesboro,30458.0,13031,Bulloch County,44340,"Statesboro, GA",Coastal,33,183600,1
2020-04-07,Financial Equipment Maintenance And Consulting Inc,Chapter,561621,Administrative and Support and Waste Management and Remediation Services,Administrative and Support Services,Security Systems Services (except Locksmiths) ,U,Male Owned,U,N,15308 Hwy 67,Statesboro,30458.0,13031,Bulloch County,44340,"Statesboro, GA",Coastal,14,183275,1
2020-04-08,"Southeast Georgia Payroll Services, Inc",Chapter,541214,"Professional, Scientific, and Technical Services","Professional, Scientific, and Technical Services",Payroll Services ,U,Female Owned,U,N,2704 Old Register Rd,Statesboro,30458.0,13031,Bulloch County,44340,"Statesboro, GA",Coastal,54,180315,1
2020-04-30,The Barquero Corporation,Corp,561720,Administrative and Support and Waste Management and Remediation Services,Administrative and Support Services,Janitorial Services ,Hispanic,Male Owned,Non-Veteran,N,1010 Grady Saunders Rd,Portal,30450.0,13031,Bulloch County,44340,"Statesboro, GA",Coastal,35,179500,1
2020-04-15,Ogeechee Ob-Gyn P.C.,Corp,621111,Health Care and Social Assistance,Ambulatory Health Care Services,Offices of Physicians (except Mental Health Specialists) ,U,U,U,N,1310 Brampton Ave,Statesboro,30458.0,13031,Bulloch County,44340,"Statesboro, GA",Coastal,14,179226,1
2020-04-30,C & L Hendrix Enterprises Inc,Chapter,111421,"Agriculture, Forestry, Fishing and Hunting",Crop Production,Nursery and Tree Production ,U,U,U,N,221 N Zetterower Ave,Statesboro,30458.0,13031,Bulloch County,44340,"Statesboro, GA",Coastal,12,176900,1
2020-04-27,"Thompson Pool & Supply Co., Inc.",Chapter,453998,Retail Trade,Miscellaneous Store Retailers,All Other Miscellaneous Store Retailers (except Tobacco Stores) ,U,U,U,N,29 North Zetterower Ave,Statesboro,30458.0,13031,Bulloch County,44340,"Statesboro, GA",Coastal,20,176545,1
2020-04-13,Marfam Inc,Corp,722513,Accommodation and Food Services,Food Services and Drinking Places,Limited-Service Restaurants ,U,U,U,N,2191 Northside Dr,Statesboro,30458.0,13031,Bulloch County,44340,"Statesboro, GA",Coastal,50,176485,1
2020-04-14,Johnston Insurance Agency Inc,Corp,524210,Finance and Insurance,Insurance Carriers and Related Activities,Insurance Agencies and Brokerages ,U,U,U,N,212 Savannah Ave,Statesboro,30458.0,13031,Bulloch County,44340,"Statesboro, GA",Coastal,18,175324,1
2020-04-30,Statesboro Ob-Gyn Specialist Pc,Corp,621111,Health Care and Social Assistance,Ambulatory Health Care Services,Offices of Physicians (except Mental Health Specialists) ,U,U,U,N,1523 Fair Rd,Statesboro,30458.0,13031,Bulloch County,44340,"Statesboro, GA",Coastal,22,175200,1
2020-04-30,Bray Dmd & Young Dmd P C,Chapter,621210,Health Care and Social Assistance,Ambulatory Health Care Services,Offices of Dentists ,U,U,U,N,2 Lester Ct,Statesboro,30458.0,13031,Bulloch County,44340,"Statesboro, GA",Coastal,14,174100,1
2020-04-28,"Lrp Hotels Of Statesboro, Llc",LLC,721110,Accommodation and Food Services,Accommodation,Hotels (except Casino Hotels) and Motels ,U,U,U,N,455 Commerce Dr,Statesboro,30458.0,13031,Bulloch County,44340,"Statesboro, GA",Coastal,52,173607,1
2020-04-15,Hypotenuse Inc,Corp,424990,Wholesale Trade,"Merchant Wholesalers, Nondurable Goods",Other Miscellaneous Nondurable Goods Merchant Wholesalers ,U,U,U,N,12313 Us Highway 301 S,Statesboro,30458.0,13031,Bulloch County,44340,"Statesboro, GA",Coastal,19,173541,1
2020-05-02,Trinity Christian School,Non-Profit,611110,Educational Services,Educational Services,Elementary and Secondary Schools ,U,U,U,Y,571 E Main St,Statesboro,30458.0,13031,Bulloch County,44340,"Statesboro, GA",Coastal,33,173000,1
2020-04-06,Fenestration Services Inc,Chapter,238150,Construction,Specialty Trade Contractors,Glass and Glazing Contractors ,U,U,U,N,16994 Highway 301 North,Statesboro,30458.0,13031,Bulloch County,44340,"Statesboro, GA",Coastal,13,168500,1
2020-04-10,East Georgia Radiology L. L. C.,LLC,621111,Health Care and Social Assistance,Ambulatory Health Care Services,Offices of Physicians (except Mental Health Specialists) ,U,U,U,N,1499 Fair Rd,Statesboro,30458.0,13031,Bulloch County,44340,"Statesboro, GA",Coastal,5,167000,1
2020-04-15,East Georgia Center For Oral And Facial Surgery Llc,LLC,621111,Health Care and Social Assistance,Ambulatory Health Care Services,Offices of Physicians (except Mental Health Specialists) ,U,U,U,N,1222 Brampton Ave,Statesboro,30458.0,13031,Bulloch County,44340,"Statesboro, GA",Coastal,20,162738,1
2020-04-30,"S R Construction Services, Inc.",Chapter,236115,Construction,Construction of Buildings,New Single-Family Housing Construction (except For-Sale Builders) ,U,U,U,N,735 Sandhill Road,Brooklet,30415.0,13031,Bulloch County,44340,"Statesboro, GA",Coastal,0,161350,1
