Date,Recipient,BusinessType,NAICS,Industry-2,Industry-3,Industry,RaceEthnicity,Gender,Veteran,NonProfit,Address,City,ZCTA,FIPS,County,CBSA,MSA,CDRegion,Jobs,Amount,Loans
2020-05-01,Industrial Piping Services L.L.C.,Sole Oroprietor,237110,Construction,Heavy and Civil Engineering Construction,Water and Sewer Line and Related Structures Construction ,U,Male Owned,Non-Veteran,N,304 N Armed Forces Blvd,Warner Robins,31088.0,13153,Houston County,47580,"Warner Robins, GA",West,1,10750,1
2020-05-07,Ppp Camelia Llc,Corp,453310,Retail Trade,Miscellaneous Store Retailers,Used Merchandise Stores ,U,U,U,N,402 S Camellia Blvd,Fort Valley,31030.0,13225,Peach County,47580,"Warner Robins, GA",West,6,10696,1
2020-04-28,Feld Two Inc.,Corp,611620,Educational Services,Educational Services,Sports and Recreation Instruction ,U,Male Owned,U,N,229 Wes Park Dr,Perry,31069.0,13153,Houston County,47580,"Warner Robins, GA",West,4,10633,1
2020-05-04,H F Lawson Llc,Sole Oroprietor,524210,Finance and Insurance,Insurance Carriers and Related Activities,Insurance Agencies and Brokerages ,U,U,U,N,33 Kamelia Drive,Hawkinsville,31036.0,13235,Pulaski County,47580,"Warner Robins, GA",Central,1,10615,1
2020-05-19,"East Coast Horseshoe Supply Company, Llc",Self-Employed,453910,Retail Trade,Miscellaneous Store Retailers,Pet and Pet Supplies Stores ,U,U,U,N,131 Regur Road,Hawkinsville,31036.0,13235,Pulaski County,47580,"Warner Robins, GA",Central,1,10596,1
2020-06-28,Robins Fotobooth,Self-Employed,812990,Other Services (except Public Administration),Personal and Laundry Services,All Other Personal Services ,U,U,U,N,"102 Pine Trace Lane , Kathleen , Ga, 31047",Kathleen,31047.0,13153,Houston County,47580,"Warner Robins, GA",West,3,10500,1
2020-04-28,Ronal W. Griffore,Sole Oroprietor,484121,Transportation and Warehousing,Truck Transportation,"General Freight Trucking, Long-Distance, Truckload ",U,U,U,N,3305 Moody Rd,Kathleen,31047.0,13153,Houston County,47580,"Warner Robins, GA",West,1,10482,1
2020-07-08,Bao Le,Contractor,484110,Transportation and Warehousing,Truck Transportation,"General Freight Trucking, Local ",U,U,U,N,117 Abercorn St,Warner Robins,31088.0,13153,Houston County,47580,"Warner Robins, GA",West,1,10445,1
2020-05-01,Artistic Cabinets &Amp; Flooring Llc,LLC,238340,Construction,Specialty Trade Contractors,Tile and Terrazzo Contractors,U,U,U,N,Galleria Pointe Suite P,Centerville,31028.0,13153,Houston County,47580,"Warner Robins, GA",West,7,10437,1
2020-05-21,Jeffery Sparrow,Contractor,484121,Transportation and Warehousing,Truck Transportation,"General Freight Trucking, Long-Distance, Truckload ",U,U,U,N,101 Chris Dr,Warner Robins,31088.0,13153,Houston County,47580,"Warner Robins, GA",West,1,10422,1
2020-05-01,Neuropsychological Testing And Counseling,LLC,561990,Administrative and Support and Waste Management and Remediation Services,Administrative and Support Services,All Other Support Services,U,U,U,N,102 Gunn Rd,Centerville,31028.0,13153,Houston County,47580,"Warner Robins, GA",West,1,10417,1
2020-06-15,Ruben Construction Llc,LLC,236118,Construction,Construction of Buildings,Residential Remodelers ,U,Male Owned,U,N,317 Durango Pass,Warner Robins,31088.0,13153,Houston County,47580,"Warner Robins, GA",West,1,10403,1
2020-07-14,"Warner Robins Transit, Llc",LLC,485999,Transportation and Warehousing,Transit and Ground Passenger Transportation,All Other Transit and Ground Passenger Transportation ,American Indian or Alaska Native,Female Owned,Non-Veteran,N,"1109 Russell Parkway, Suite B2",Warner Robins,31088.0,13153,Houston County,47580,"Warner Robins, GA",West,5,10402,1
2020-04-11,Countertop Solutions Grnt & Marble,Corp,337110,Manufacturing,Furniture and Related Product Manufacturing,Wood Kitchen Cabinet and Countertop Manufacturing,U,U,U,N,101 Industrial Way,Byron,31008.0,13225,Peach County,47580,"Warner Robins, GA",West,1,10400,1
2020-04-11,"Rajputana, Inc",Chapter,445310,Retail Trade,Food and Beverage Stores,"Beer, Wine, and Liquor Stores ",U,U,U,N,545 N Davis Dr,Warner Robins,31088.0,13153,Houston County,47580,"Warner Robins, GA",West,3,10400,1
2020-04-28,Shreeji Hospitality Llc,LLC,721110,Accommodation and Food Services,Accommodation,Hotels (except Casino Hotels) and Motels ,Asian,Male Owned,Non-Veteran,N,1440 Watson Blvd,Warner Robins,31088.0,13153,Houston County,47580,"Warner Robins, GA",West,4,10380,1
2020-05-01,Alok Llc,LLC,445310,Retail Trade,Food and Beverage Stores,"Beer, Wine, and Liquor Stores ",U,Male Owned,Non-Veteran,N,400 S Camellia Blvd,Fort Valley,31030.0,13225,Peach County,47580,"Warner Robins, GA",West,2,10333,1
2020-04-30,Dantavious  M. Harris,Sole Oroprietor,484220,Transportation and Warehousing,Truck Transportation,"Specialized Freight (except Used Goods) Trucking, Local ",U,U,U,N,37 Chestnut Hill Rd,Fort Valley,31030.0,13225,Peach County,47580,"Warner Robins, GA",West,1,10326,1
2020-04-11,Shagundhrish Inc,Corp,447110,Retail Trade,Gasoline Stations,Gasoline Stations with Convenience Stores ,Asian,U,U,N,121 N Camellia Blvd,Fort Valley,31030.0,13225,Peach County,47580,"Warner Robins, GA",West,2,10312,1
2020-06-12,Best Rest Anesthesia Of Ga,Corp,621399,Health Care and Social Assistance,Ambulatory Health Care Services,Offices of All Other Miscellaneous Health Practitioners ,U,U,U,N,328 Sage Meadows Lane,Bonaire,31005.0,13153,Houston County,47580,"Warner Robins, GA",West,2,10271,1
2020-06-30,Upside Down A Llc,Contractor,812990,Other Services (except Public Administration),Personal and Laundry Services,All Other Personal Services ,U,U,U,N,122 Olde Hickory Circle,Bonaire,31005.0,13153,Houston County,47580,"Warner Robins, GA",West,1,10250,1
2020-05-29,Wildflower Weddings And More,Self-Employed,453998,Retail Trade,Miscellaneous Store Retailers,All Other Miscellaneous Store Retailers (except Tobacco Stores) ,U,U,U,N,135 Broad Street,Hawkinsville,31036.0,13235,Pulaski County,47580,"Warner Robins, GA",Central,0,10233,1
2020-04-07,Dawg-Eared Booksellers Llc,LLC,451211,Retail Trade,"Sporting Goods, Hobby, Musical Instrument, and Book Stores",Book Stores ,U,U,U,N,115 Huntington Way,Centerville,31028.0,13153,Houston County,47580,"Warner Robins, GA",West,5,10199,1
2020-04-09,Vishwash Llc,LLC,445310,Retail Trade,Food and Beverage Stores,"Beer, Wine, and Liquor Stores ",U,U,U,N,506 Arbor Ln,Centerville,31028.0,13153,Houston County,47580,"Warner Robins, GA",West,3,10125,1
2020-05-03,Kim Nails Service Llc,LLC,812113,Other Services (except Public Administration),Personal and Laundry Services,Nail Salons ,U,U,U,N,2706 Watson Blvd Ste H,Warner Robins,31088.0,13153,Houston County,47580,"Warner Robins, GA",West,6,10115,1
2020-06-02,Dominique Jones,Self-Employed,811121,Other Services (except Public Administration),Repair and Maintenance,"Automotive Body, Paint, and Interior Repair and Maintenance ",U,U,U,N,203 Audubon Way,Warner Robins,31088.0,13153,Houston County,47580,"Warner Robins, GA",West,1,10024,1
2020-04-11,Maa Ruti Properties Inc,Corp,721110,Accommodation and Food Services,Accommodation,Hotels (except Casino Hotels) and Motels ,U,Male Owned,Non-Veteran,N,515 Old Macon Rd,Byron,31008.0,13225,Peach County,47580,"Warner Robins, GA",West,5,10011,1
2020-04-27,Recollections By Lynn Llc,LLC,453110,Retail Trade,Miscellaneous Store Retailers,Florists ,U,U,U,N,811 Carroll Street,Perry,31069.0,13153,Houston County,47580,"Warner Robins, GA",West,2,10002,1
2020-07-12,Darrin Clark,Sole Oroprietor,453998,Retail Trade,Miscellaneous Store Retailers,All Other Miscellaneous Store Retailers (except Tobacco Stores) ,U,U,U,N,104 Galaxy Avenue,Bonaire,31005.0,13153,Houston County,47580,"Warner Robins, GA",West,1,10000,1
2020-04-29,Tmt Of Peach County Llc,LLC,452319,Retail Trade,General Merchandise Stores,All Other General Merchandise Stores ,U,U,U,N,2106 Hwy 247 Connector,Byron,31008.0,13225,Peach County,47580,"Warner Robins, GA",West,0,10000,1
2020-07-14,Hollywood Nails Tc Llc,LLC,812113,Other Services (except Public Administration),Personal and Laundry Services,Nail Salons ,U,U,U,N,"1845 Watson Blvd,1845 Watson Boulevard",Warner Robins,31088.0,13153,Houston County,47580,"Warner Robins, GA",West,8,10000,1
2020-04-27,Prabhujyot Llc,LLC,447110,Retail Trade,Gasoline Stations,Gasoline Stations with Convenience Stores ,Asian,Male Owned,Non-Veteran,N,280 Carl Vinson Blvd,Warner Robins,31088.0,13153,Houston County,47580,"Warner Robins, GA",West,2,10000,1
2020-05-29,Aba Unlimited Llc,LLC,621330,Health Care and Social Assistance,Ambulatory Health Care Services,Offices of Mental Health Practitioners (except Physicians) ,U,U,U,N,1000 Corporate Pointe,Warner Robins,31088.0,13153,Houston County,47580,"Warner Robins, GA",West,4,10000,1
2020-04-27,"International City Manufacturing, Llc",LLC,335999,Manufacturing,"Electrical Equipment, Appliance, and Component Manufacturing",All Other Miscellaneous Electrical Equipment and Component Manufacturing ,U,U,U,N,108 Olympia Drive,Warner Robins,31088.0,13153,Houston County,47580,"Warner Robins, GA",West,1,10000,1
2020-04-27,"Cornerstone Creative, Llc",LLC,541922,"Professional, Scientific, and Technical Services","Professional, Scientific, and Technical Services",Commercial Photography ,U,U,U,N,105 Derby Downs,Perry,31069.0,13153,Houston County,47580,"Warner Robins, GA",West,1,10000,1
2020-04-28,Bapu Hotel Llc,LLC,721110,Accommodation and Food Services,Accommodation,Hotels (except Casino Hotels) and Motels ,Asian,Male Owned,U,N,2079 Watson Blvd,Warner Robins,31088.0,13153,Houston County,47580,"Warner Robins, GA",West,4,10000,1
2020-05-20,Kimberly Farms,Sole Oroprietor,112320,"Agriculture, Forestry, Fishing and Hunting",Animal Production and Aquaculture,Broilers and Other Meat Type Chicken Production ,U,U,U,N,106 Orchard Rd,Perry,31069.0,13153,Houston County,47580,"Warner Robins, GA",West,1,10000,1
2020-08-04,Clareence R. Brown,Self-Employed,811310,Other Services (except Public Administration),Repair and Maintenance,Commercial and Industrial Machinery and Equipment (except Automotive and Electronic) Repair and Maintenance ,U,U,U,N,2267 Us Highway 41,Perry,31069.0,13153,Houston County,47580,"Warner Robins, GA",West,1,9960,1
2020-04-15,G&L Home Solutions Incorporated,Corp,236220,Construction,Construction of Buildings,Commercial and Institutional Building Construction ,U,U,U,N,909 Lower River Rd,Hawkinsville,31036.0,13235,Pulaski County,47580,"Warner Robins, GA",Central,5,9917,1
2020-04-28,Steve Ryan Llc,LLC,711510,"Arts, Entertainment, and Recreation","Performing Arts, Spectator Sports, and Related Industries","Independent Artists, Writers, and Performers ",U,U,U,N,414 Johns Rd,Warner Robins,31088.0,13153,Houston County,47580,"Warner Robins, GA",West,0,9880,1
2020-05-01,Tony Wagoner Llc.,LLC,561499,Administrative and Support and Waste Management and Remediation Services,Administrative and Support Services,All Other Business Support Services ,U,U,U,N,214 Caleb Way,Byron,31008.0,13225,Peach County,47580,"Warner Robins, GA",West,1,9857,1
2020-04-27,"T&D Mason Farms, Llc",LLC,532490,Real Estate and Rental and Leasing,Rental and Leasing Services,Other Commercial and Industrial Machinery and Equipment Rental and Leasing ,U,U,U,N,130 Van Dr,Kathleen,31047.0,13153,Houston County,47580,"Warner Robins, GA",West,3,9847,1
2020-04-30,Blount Trucking Llc,LLC,488510,Transportation and Warehousing,Support Activities for Transportation,Freight Transportation Arrangement ,U,U,U,N,818 Ga Highway 247 S,Kathleen,31047.0,13153,Houston County,47580,"Warner Robins, GA",West,1,9817,1
2020-04-30,Ark Curry House Llc,LLC,999990,,,,U,U,U,N,4025 Watson Blvd Suite 290,Warner Robins,31088.0,13153,Houston County,47580,"Warner Robins, GA",West,0,9800,1
2020-04-14,Cyber Pinecone Llc,LLC,541613,"Professional, Scientific, and Technical Services","Professional, Scientific, and Technical Services",Marketing Consulting Services ,U,U,U,N,111 Prestige Dr,Warner Robins,31088.0,13153,Houston County,47580,"Warner Robins, GA",West,2,9750,1
2020-07-17,Kimbercrow,Sole Oroprietor,541611,"Professional, Scientific, and Technical Services","Professional, Scientific, and Technical Services",Administrative Management and General Management Consulting Services ,U,Male Owned,U,N,209 Sandy Springs Dr,Bonaire,31005.0,13153,Houston County,47580,"Warner Robins, GA",West,1,9741,1
2020-04-28,"Teamworks Property Management, Llc",LLC,531311,Real Estate and Rental and Leasing,Real Estate,Residential Property Managers ,U,U,U,N,402 Ga Highway 247,Bonaire,31005.0,13153,Houston County,47580,"Warner Robins, GA",West,2,9741,1
2020-04-27,J Ross Electric Inc,Corp,238210,Construction,Specialty Trade Contractors,Electrical Contractors and Other Wiring Installation Contractors,U,Male Owned,Non-Veteran,N,2043 Us Highway 41 S,Perry,31069.0,13153,Houston County,47580,"Warner Robins, GA",West,2,9700,1
2020-04-29,"Rebuilding Together Warner Robins, Inc.",Corp,624229,Health Care and Social Assistance,Social Assistance,Other Community Housing Services ,U,Male Owned,U,N,110 Oak Grove Road,Warner Robins,31088.0,13153,Houston County,47580,"Warner Robins, GA",West,2,9667,1
2020-04-28,"F3 Patriot, Llc",LLC,541330,"Professional, Scientific, and Technical Services","Professional, Scientific, and Technical Services",Engineering Services,U,U,U,N,150 Osigian Blvd,Warner Robins,31088.0,13153,Houston County,47580,"Warner Robins, GA",West,3,9666,1
2020-04-11,Perry Self Storage Llc,LLC,531110,Real Estate and Rental and Leasing,Real Estate,Lessors of Residential Buildings and Dwellings ,U,U,U,N,518 General Courtney Hodges Blvd,Perry,31069.0,13153,Houston County,47580,"Warner Robins, GA",West,2,9580,1
2020-04-27,Silverspoon Learning Center,Corp,624410,Health Care and Social Assistance,Social Assistance,Child Day Care Services ,U,U,U,N,221 Everett Sq,Warner Robins,31088.0,13153,Houston County,47580,"Warner Robins, GA",West,9,9580,1
2020-05-01,Frank Harder,Contractor,812199,Other Services (except Public Administration),Personal and Laundry Services,Other Personal Care Services ,U,U,U,N,"1217 S Houston Lake Rd, Suite 1",Warner Robins,31088.0,13153,Houston County,47580,"Warner Robins, GA",West,1,9534,1
2020-04-11,Harold E Dunaway Jr,Sole Oroprietor,111930,"Agriculture, Forestry, Fishing and Hunting",Crop Production,Sugarcane Farming,White,Male Owned,Non-Veteran,N,339 Tom Taylor Road,Hawkinsville,31036.0,13235,Pulaski County,47580,"Warner Robins, GA",Central,6,9505,1
2020-04-15,Provision Enterprises Inc,Corp,238160,Construction,Specialty Trade Contractors,Roofing Contractors ,U,Female Owned,U,N,1238 S Houston Lake Road,Warner Robins,31088.0,13153,Houston County,47580,"Warner Robins, GA",West,4,9502,1
2020-04-11,Ashlee Culverhouse Cleveland,Sole Oroprietor,541921,"Professional, Scientific, and Technical Services","Professional, Scientific, and Technical Services","Photography Studios, Portrait ",U,U,U,N,35 Rigdon Way,Fort Valley,31030.0,13225,Peach County,47580,"Warner Robins, GA",West,1,9500,1
2020-04-09,"Mahant 007, Llc",LLC,445120,Retail Trade,Food and Beverage Stores,Convenience Stores ,U,U,U,N,2991 Us Highway 41 N,Fort Valley,31030.0,13225,Peach County,47580,"Warner Robins, GA",West,0,9500,1
2020-04-09,Bgp Farms,Partnership,111150,"Agriculture, Forestry, Fishing and Hunting",Crop Production,Corn Farming ,U,U,U,N,2055 Kings Chapel Rd.,Perry,31069.0,13153,Houston County,47580,"Warner Robins, GA",West,1,9500,1
2020-05-11,Taylor Levieux,LLC,524210,Finance and Insurance,Insurance Carriers and Related Activities,Insurance Agencies and Brokerages ,U,U,U,N,613 Russell Pkwy,Warner Robins,31088.0,13153,Houston County,47580,"Warner Robins, GA",West,1,9449,1
2020-05-14,"Hoco Power, Llc",LLC,238990,Construction,Specialty Trade Contractors,All Other Specialty Trade Contractors,U,U,U,N,1114 Briarcliff Rd,Perry,31069.0,13153,Houston County,47580,"Warner Robins, GA",West,2,9430,1
2020-05-28,"Aquatic Escapes, Llc",Self-Employed,541618,"Professional, Scientific, and Technical Services","Professional, Scientific, and Technical Services",Other Management Consulting Services ,U,U,U,N,312 Lake Joy Rd,Perry,31069.0,13153,Houston County,47580,"Warner Robins, GA",West,2,9424,1
2020-05-07,Drf Development Llc,LLC,522292,Finance and Insurance,Credit Intermediation and Related Activities,Real Estate Credit ,U,U,U,N,1205 Deer Run Trail,Perry,31069.0,13153,Houston County,47580,"Warner Robins, GA",West,7,9376,1
2020-06-26,Appointing Pros,Sole Oroprietor,524210,Finance and Insurance,Insurance Carriers and Related Activities,Insurance Agencies and Brokerages ,U,U,U,N,"727 Old Perry Rd , Kathleen , Ga, 31047",Kathleen,31047.0,13153,Houston County,47580,"Warner Robins, GA",West,3,9375,1
2020-07-24,Tucker Fishing,Self-Employed,112511,"Agriculture, Forestry, Fishing and Hunting",Animal Production and Aquaculture,Finfish Farming and Fish Hatcheries ,U,U,U,N,1706 Tucker Rd,Perry,31069.0,13153,Houston County,47580,"Warner Robins, GA",West,1,9351,1
2020-07-28,Glenis Blue,Sole Oroprietor,624190,Health Care and Social Assistance,Social Assistance,Other Individual and Family Services ,U,U,U,N,107 Tina Drive,Warner Robins,31088.0,13153,Houston County,47580,"Warner Robins, GA",West,0,9342,1
2020-04-15,St. Juliana Catholic Church,Non-Profit,813110,Other Services (except Public Administration),"Religious, Grantmaking, Civic, Professional, and Similar Organizations",Religious Organizations ,U,U,U,Y,804 Martin Luther King Jr Dr,Fort Valley,31030.0,13225,Peach County,47580,"Warner Robins, GA",West,5,9338,1
2020-05-05,"Perry Liquor, Llc",LLC,445310,Retail Trade,Food and Beverage Stores,"Beer, Wine, and Liquor Stores ",U,Male Owned,Non-Veteran,N,277 Perry Pkwy,Perry,31069.0,13153,Houston County,47580,"Warner Robins, GA",West,2,9324,1
2020-04-11,"Gunatit, Inc.",Chapter,445310,Retail Trade,Food and Beverage Stores,"Beer, Wine, and Liquor Stores ",U,U,U,N,4070 Highway 41 N,Byron,31008.0,13225,Peach County,47580,"Warner Robins, GA",West,3,9300,1
2020-06-29,Jai Veer Bali Llc,LLC,447110,Retail Trade,Gasoline Stations,Gasoline Stations with Convenience Stores ,U,U,U,N,599 South Houston Lake Road,Warner Robins,31088.0,13153,Houston County,47580,"Warner Robins, GA",West,3,9221,1
2020-07-26,Dba Samantha Taylor,Contractor,423860,Wholesale Trade,"Merchant Wholesalers, Durable Goods",Transportation Equipment and Supplies (except Motor Vehicle) Merchant Wholesalers ,U,U,U,N,66 Perdue Lane,Fort Valley,31030.0,13225,Peach County,47580,"Warner Robins, GA",West,1,9200,1
2020-04-28,"Tom And Sandy'S Horseshoe Restaurant, Inc.",Chapter,722511,Accommodation and Food Services,Food Services and Drinking Places,Full-Service Restaurants ,U,Male Owned,U,N,194 Broad St,Hawkinsville,31036.0,13235,Pulaski County,47580,"Warner Robins, GA",Central,9,9154,1
2020-05-01,Southern Eyecare Of Georgia Inc,Corp,621320,Health Care and Social Assistance,Ambulatory Health Care Services,Offices of Optometrists,U,U,U,N,6080 Lakeview Rd Apt 3301,Warner Robins,31088.0,13153,Houston County,47580,"Warner Robins, GA",West,0,9133,1
2020-05-13,Brilliant Stars Academy Inc,Corp,624410,Health Care and Social Assistance,Social Assistance,Child Day Care Services ,U,U,U,N,411 Martin Luther King Jr. Dr.,Perry,31069.0,13153,Houston County,47580,"Warner Robins, GA",West,0,9127,1
2020-05-06,"Clemons Agency, Inc",Chapter,524210,Finance and Insurance,Insurance Carriers and Related Activities,Insurance Agencies and Brokerages ,U,U,U,N,119 Commerce St,Hawkinsville,31036.0,13235,Pulaski County,47580,"Warner Robins, GA",Central,0,9126,1
2020-07-30,Cleghorn Music Ministries Inc,Corp,813110,Other Services (except Public Administration),"Religious, Grantmaking, Civic, Professional, and Similar Organizations",Religious Organizations ,U,Male Owned,U,N,406 Wrasling Way,Bonaire,31005.0,13153,Houston County,47580,"Warner Robins, GA",West,1,9125,1
2020-04-15,Top Team Medical Supply Llc,LLC,454390,Retail Trade,Nonstore Retailers,Other Direct Selling Establishments ,U,Male Owned,U,N,305 Vinings Place Drive,Warner Robins,31088.0,13153,Houston County,47580,"Warner Robins, GA",West,1,9116,1
2020-04-06,"Hayes Custom Homes, Llc",LLC,236115,Construction,Construction of Buildings,New Single-Family Housing Construction (except For-Sale Builders) ,U,U,U,N,50 Mossy Creek Dr,Fort Valley,31030.0,13225,Peach County,47580,"Warner Robins, GA",West,3,9106,1
2020-04-15,Kaitlynn Marie Taylor Dba Kaitlynn Taylor,Sole Oroprietor,453998,Retail Trade,Miscellaneous Store Retailers,All Other Miscellaneous Store Retailers (except Tobacco Stores) ,U,Female Owned,Non-Veteran,N,212 Wynfield Lane,Bonaire,31005.0,13153,Houston County,47580,"Warner Robins, GA",West,1,9100,1
2020-04-05,Appraisal Services,Partnership,531320,Real Estate and Rental and Leasing,Real Estate,Offices of Real Estate Appraisers ,U,U,U,N,107 Park Avenue,Warner Robins,31088.0,13153,Houston County,47580,"Warner Robins, GA",West,1,9093,1
2020-05-12,Sheila Aycock,Contractor,812112,Other Services (except Public Administration),Personal and Laundry Services,Beauty Salons ,U,U,U,N,218 Kingsbury Cir,Warner Robins,31088.0,13153,Houston County,47580,"Warner Robins, GA",West,1,9081,1
2020-04-14,"Oakridge Custom Finishing, Llc",LLC,451110,Retail Trade,"Sporting Goods, Hobby, Musical Instrument, and Book Stores",Sporting Goods Stores ,U,U,U,N,2292 Mood Rd Suite 100,Warner Robins,31088.0,13153,Houston County,47580,"Warner Robins, GA",West,4,9062,1
2020-04-28,"New Era Energies, Inc",Chapter,424720,Wholesale Trade,"Merchant Wholesalers, Nondurable Goods",Petroleum and Petroleum Products Merchant Wholesalers (except Bulk Stations and Terminals) ,U,U,U,N,545 N Davis Dr,Warner Robins,31088.0,13153,Houston County,47580,"Warner Robins, GA",West,2,9031,1
2020-04-28,"Keshavjivandas, Llc",LLC,999990,,,,U,U,U,N,1054 Ga Highway 247,Kathleen,31047.0,13153,Houston County,47580,"Warner Robins, GA",West,2,9000,1
2020-04-29,"Cherokee Pines Golf & Fitness Club, Inc.",Chapter,448120,Retail Trade,Clothing and Clothing Accessories Stores,Women's Clothing Stores ,U,Male Owned,U,N,1303 Forest Hill Dr,Perry,31069.0,13153,Houston County,47580,"Warner Robins, GA",West,2,8996,1
2020-04-30,Robertson Performance Garage,Self-Employed,811111,Other Services (except Public Administration),Repair and Maintenance,General Automotive Repair ,U,U,U,N,John Mays Road,Hawkinsville,31036.0,13235,Pulaski County,47580,"Warner Robins, GA",Central,1,8986,1
2020-05-25,All Affair Inc.,Corp,488999,Transportation and Warehousing,Support Activities for Transportation,All Other Support Activities for Transportation ,U,U,U,N,535 Maggie Ln,Fort Valley,31030.0,13225,Peach County,47580,"Warner Robins, GA",West,2,8983,1
2020-04-10,"Blue Sky Maintenance Solutions, Llc",LLC,811490,Other Services (except Public Administration),Repair and Maintenance,Other Personal and Household Goods Repair and Maintenance ,U,U,U,N,2929 Watson Blve,Warner Robins,31088.0,13153,Houston County,47580,"Warner Robins, GA",West,4,8962,1
2020-04-27,Electric Lotus Ink Inc,Corp,812199,Other Services (except Public Administration),Personal and Laundry Services,Other Personal Care Services ,U,U,U,N,1003 Russell Pkwy,Warner Robins,31088.0,13153,Houston County,47580,"Warner Robins, GA",West,2,8925,1
2020-04-14,George Edward Finleyson,Sole Oroprietor,423210,Wholesale Trade,"Merchant Wholesalers, Durable Goods",Furniture Merchant Wholesalers ,U,Male Owned,Non-Veteran,N,413 Eastman Hwy,Hawkinsville,31036.0,13235,Pulaski County,47580,"Warner Robins, GA",Central,1,8890,1
2020-04-29,Khodal 198 Llc,Chapter,447110,Retail Trade,Gasoline Stations,Gasoline Stations with Convenience Stores ,U,U,U,N,1063 Russell Pkwy,Warner Robins,31088.0,13153,Houston County,47580,"Warner Robins, GA",West,2,8800,1
2020-04-27,Lisamae Cakes & Cookies Llc,LLC,722310,Accommodation and Food Services,Food Services and Drinking Places,Food Service Contractors,U,U,Non-Veteran,N,1485 Po Box 1485,Byron,31008.0,13225,Peach County,47580,"Warner Robins, GA",West,2,8779,1
2020-07-10,Wendy Way,Sole Oroprietor,531210,Real Estate and Rental and Leasing,Real Estate,Offices of Real Estate Agents and Brokers,U,U,U,N,1023 Rock Road,Perry,31069.0,13153,Houston County,47580,"Warner Robins, GA",West,0,8765,1
2020-04-15,Ronald Knight,Sole Oroprietor,236220,Construction,Construction of Buildings,Commercial and Institutional Building Construction ,U,Male Owned,U,N,1593 Holland Rd,Fort Valley,31030.0,13225,Peach County,47580,"Warner Robins, GA",West,3,8750,1
2020-04-06,Bij Llc,LLC,447110,Retail Trade,Gasoline Stations,Gasoline Stations with Convenience Stores ,U,U,U,N,700 Feagin Mill Rd,Warner Robins,31088.0,13153,Houston County,47580,"Warner Robins, GA",West,2,8750,1
2020-04-28,"Jaineel, Llc",LLC,445310,Retail Trade,Food and Beverage Stores,"Beer, Wine, and Liquor Stores ",U,U,U,N,715 Ga Highway 247,Bonaire,31005.0,13153,Houston County,47580,"Warner Robins, GA",West,2,8750,1
2020-05-19,Veera Shiv Inc,Chapter,445210,Retail Trade,Food and Beverage Stores,Meat Markets ,U,U,U,N,147 Commerce St,Hawkinsville,31036.0,13235,Pulaski County,47580,"Warner Robins, GA",Central,2,8750,1
2020-04-28,Tangles,Sole Oroprietor,812112,Other Services (except Public Administration),Personal and Laundry Services,Beauty Salons ,U,U,U,N,135 Broad Street,Hawkinsville,31036.0,13235,Pulaski County,47580,"Warner Robins, GA",Central,1,8693,1
2020-04-27,Robert Gene Potter,Sole Oroprietor,561720,Administrative and Support and Waste Management and Remediation Services,Administrative and Support Services,Janitorial Services ,White,U,Non-Veteran,N,112 N Amanda Pl,Warner Robins,31088.0,13153,Houston County,47580,"Warner Robins, GA",West,6,8685,1
2020-05-18,"Freedom Drivers Of America, Llc",LLC,484110,Transportation and Warehousing,Truck Transportation,"General Freight Trucking, Local ",U,U,U,N,301 Club Villa Court #3,Kathleen,31047.0,13153,Houston County,47580,"Warner Robins, GA",West,1,8666,1
2020-05-01,Margaret Dee Smith,Sole Oroprietor,0,,,,U,U,U,N,110 Covey Rise,Warner Robins,31088.0,13153,Houston County,47580,"Warner Robins, GA",West,1,8650,1
